category,brand,product,price,weight,badge,shelf_life,country,rating,num_of_reviews,recommend,ingredient,reviews,nutrition,image_link,product_link,category_link
Fresh & Chilled Food,M&S,M&S Organic British Beef Ribeye Steak,7.5,Typically: 250g,"Suitable for freezing, Organic",LIFE 7d+,UK,3.3,8,50,NA,,,https://www.ocado.com/productImages/541/541371011_0_150x150.jpg?identifier=8a28e7e99cc483c98113b203ea98117b,https://www.ocado.com/products/m-s-organic-british-beef-ribeye-steak-541371011,https://www.ocado.com/browse/fresh-chilled-food-20002?hideOOS=true
Fresh & Chilled Food,Pizza Pilgrims,Pizza Pilgrims Margherita Pizza Kit For 2,14.5,890g,Suitable for vegetarians,LIFE 3d+,United Kingdom,3.7,52,62,"WHEAT Flour, Water, Mozzarella (MILK), Crushed Tomatoes, Tomato Juice, Rice Flour, Sunflower Oil, Vegetarian Hard Cheese (MILK), Salt, Extra Virgin Olive Oil, Basil, Garlic, Black Pepper, Yeast, Antioxidant, Ascorbic acid",,,https://www.ocado.com/productImages/563/563903011_0_150x150.jpg?identifier=e1aef07f00b636125603fed94e30c4a7,https://www.ocado.com/products/pizza-pilgrims-margherita-pizza-kit-for-2-563903011,https://www.ocado.com/browse/fresh-chilled-food-20002?hideOOS=true
Fresh & Chilled Food,M&S,M&S Fruit Wedge Selection,12.6,1.21kg,Suitable for vegetarians,NA,United Kingdom,3.1,12,75,"Melon (28%), Watermelon (26%), Apples (17%), Pineapple (16%), Mango (13%)Allergen Information",,,https://www.ocado.com/productImages/517/517732011_0_150x150.jpg?identifier=8278cbe5aeacd5b8a55ef27baf314c45,https://www.ocado.com/products/m-s-fruit-wedge-selection-517732011,https://www.ocado.com/browse/fresh-chilled-food-20002?hideOOS=true
Fresh & Chilled Food,M&S,M&S Plant Kitchen 4 No Chicken Gyozas,2.9,120g,"Suitable for freezing, Suitable for the microwave, Suitable for vegetarians",LIFE 4d+,Vietnam,4.3,37,79,"No Chic'n Gyozas:Wheatflour contains Gluten (with Wheatflour, Zinc, Iron), Textured Wheat Protein (Water, Wheat Gluten, Firming Agent: E516, Preservative: E223 (Sulphites)), Textured Soya Protein (Water, Soya Protein, Wheat Gluten, Salt, Soybean Oil, Flavouring), Water, Oyster Mushrooms, Cabbage, Sunflower Oil, Tapioca Starch, Onions, Shiitake Mushrooms, Soy Sauce (Water, Soybeans, Wheat (contains Gluten), Salt), Chinese Chives, Sake, Garlic, Mirin Wine, Spring Onions, Sesame Oil, Sugar, Ginger, Flavouring, Miso Paste (Soybeans, Rice, Salt, Rice Wine), Salt, Yeast Extract, Ground Black Pepper, Ground Red Chillies",,,https://www.ocado.com/productImages/527/527735011_0_150x150.jpg?identifier=87df49ceb350abd3585908c2467ff665,https://www.ocado.com/products/m-s-plant-kitchen-4-no-chicken-gyozas-527735011,https://www.ocado.com/browse/fresh-chilled-food-20002?hideOOS=true
"Soft Drinks, Tea & Coffee",Wunder Workshop,Wunder Workshop Turmeric Tea,6.3,70g,"Organic, Suitable for vegetarians",NA,United Kingdom,4.3,13,77,"Turmeric (55%)*, Ginger*, Lemongrass*, Ceylon Cinnamon*, *Organic ingredients",,,https://www.ocado.com/productImages/422/422286011_0_150x150.jpg?identifier=35fe231c6e24eda706a0f68a8c6eb0cd,https://www.ocado.com/products/wunder-workshop-turmeric-tea-422286011,https://www.ocado.com/browse/soft-drinks-tea-coffee-20977?hideOOS=true
Fresh & Chilled Food,Sound Seafood,Sound Seafood Skinless Smoked Haddock,4.35,250g,"Suitable for freezing, Suitable for the microwave",LIFE 4d,United Kingdom,2.9,27,49,"Haddock (Melanogrammus aeglefinus) (Fish) (97%), Salt, Colour: Curcumin",,,https://www.ocado.com/productImages/526/526145011_0_150x150.jpg?identifier=7916539cc1b7a838758615f58f4f1ccf,https://www.ocado.com/products/sound-seafood-skinless-smoked-haddock-526145011,https://www.ocado.com/browse/fresh-chilled-food-20002?hideOOS=true
"Soft Drinks, Tea & Coffee",XITE,XITE Energy Peach and Passionfruit,1.5,330ml,Suitable for vegetarians,NA,Austria,3.6,37,65,NA,,,https://www.ocado.com/productImages/543/543211011_0_150x150.jpg?identifier=5b8c44bb0d1f58ef8618180a8482ad44,https://www.ocado.com/products/xite-energy-peach-and-passionfruit-543211011,https://www.ocado.com/browse/soft-drinks-tea-coffee-20977?hideOOS=true
Fresh & Chilled Food,Anchor,Anchor Original Real Cream Spray,1.7,250g,Suitable for vegetarians,LIFE 3w+,EU,4.6,31,94,"Cream (95%) (Milk), Sugar (4%), Emulsifier (Mono- and Diglycerides of Fatty Acids), Stabiliser (Carrageenan), Propellant Gas (Nitrous Oxide)Dietary Information",,,https://www.ocado.com/productImages/157/15721011_0_150x150.jpg?identifier=94fe21b1cb86cbe640a93fc7250ecb6d,https://www.ocado.com/products/anchor-original-real-cream-spray-15721011,https://www.ocado.com/browse/fresh-chilled-food-20002?hideOOS=true
Fresh & Chilled Food,Ocado,Ocado Shredded Shrooms,2.3,150g,Suitable for vegetarians,LIFE 2d+,NA,5.0,5,100,King Oyster Mushrooms (100%).,,,https://www.ocado.com/productImages/570/570612011_0_150x150.jpg?identifier=c423f73ca91b6070cc38ce3e2318589b,https://www.ocado.com/products/ocado-shredded-shrooms-570612011,https://www.ocado.com/browse/fresh-chilled-food-20002?hideOOS=true
Bakery,M&S,M&S 4 Sticky Toffee Mini Loaf Cakes,3.15,294g,Suitable for vegetarians,LIFE 5d+,United Kingdom,4.5,33,88,"Sugar, Pasteurised Egg, Wheatflour contains Gluten (with Wheatflour, Calcium Carbonate, Iron, Niacin, Thiamin), Rapeseed Oil, Butter (Milk) (9%), Sweetened Condensed Skimmed Milk (Skimmed Milk, Sugar), Humectant: Glycerol, Glucose Syrup, Palm Oil, Golden Syrup (Invert Sugar Syrup), Dried Whole Milk, Dried Whey (Milk), Modified Maize Starch, Cocoa Butter, Raising Agent: E450, Sodium Bicarbonate, Calcium Phosphates, Emulsifier: E471, E477, E481, Soya Lecithin, Butter Oil (Milk), Flavouring, Wheat Gluten, Salt, Lactose (Milk), Colour: Plain Caramel, Paprika Extract, Celling Agent: Pectin, Cocoa Mass",,,https://www.ocado.com/productImages/556/556222011_0_150x150.jpg?identifier=5b65fd5a9a9175b16f2fcf4f1c36c810,https://www.ocado.com/products/m-s-4-sticky-toffee-mini-loaf-cakes-556222011,https://www.ocado.com/browse/bakery-25189?hideOOS=true
Fresh & Chilled Food,M&S,M&S Southern Fried Chicken Burgers,4.2,282g,Suitable for freezing,LIFE 3d+,United Kingdom,2.9,16,38,"Chicken Breast (70%), Wheatflour contains Gluten (with Wheatflour, Calcium Carbonate, Iron, Niacin, Thiamin), Water, Rapeseed Oil, Wheat Starch (contains Gluten), Rice Flour, Maize Flour, Broad Bean Flour, Salt, Wheat Gluten, Ground Spices (Fennel, Black Pepper, White Pepper, Paprika), Raising Agent: Sodium Bicarbonate, E450, Cracked Black Pepper, Yeast Extract, Wheat Protein (contains Gluten), Dextrose, Yeast, Dried Thyme, Sunflower Oil, Spice Extract, Black Pepper Extract, Thyme Extract",,,https://www.ocado.com/productImages/551/551723011_0_150x150.jpg?identifier=3c56d39c32100ded0bff6579a1f7276d,https://www.ocado.com/products/m-s-southern-fried-chicken-burgers-551723011,https://www.ocado.com/browse/fresh-chilled-food-20002?hideOOS=true
Fresh & Chilled Food,SodaStream,"SodaStream Kombucha Passionfruit and Mandarin, 500ml",8,NA,Suitable for vegetarians,NA,NA,2.8,4,50,"Organic Kombucha Tea (88%) (Filtered water, organic raw sugar, organic black Assam tea, organic kombucha cultures), organic mandarin juice, organic passionfruit juice reconstituted, natural flavours, citric acid, probiotic cultures, (BC unique - bacillus coagulans)Product details",,,https://www.ocado.com/productImages/539/539706011_0_150x150.jpg?identifier=bd5a76cdc5783e1bd7c56cdfaa91bde0,https://www.ocado.com/products/sodastream-kombucha-passionfruit-and-mandarin-500ml-539706011,https://www.ocado.com/browse/fresh-chilled-food-20002?hideOOS=true
Fresh & Chilled Food,DAYLESFORD ORGANIC,Daylesford Organic Chocolate Dipped Ginger Biscuits,3.9899999999999998,150g,Organic,NA,NA,3.3,8,50,"Fortified Wheat Flour, Dark Chocolate (23%), Sugar, Unsalted Butter (Milk), Stem Ginger (10%) (Ginger, Sugar), Ground Ginger (2%), Invert Sugar Syrup, Sea Salt*, Raising Agent (Ammonium Bicarbonate*).WHEAT FLOWER: Calcium Carbonate*, Iorn*, Niacin*, Thiamin*.DARK CHOCOLATE: Cocoa Mass, Sugar, Cocoa Butter, Vanilla Powder. *Non-organic.Allergen Information",,,https://www.ocado.com/productImages/502/50247011_0_150x150.jpg?identifier=3f3e888fdaf922b7a20c2bbfb4b7f13d,https://www.ocado.com/products/daylesford-organic-chocolate-dipped-ginger-biscuits-50247011,https://www.ocado.com/browse/fresh-chilled-food-20002?hideOOS=true
Fresh & Chilled Food,Optimum Nutrition,Optimum Nutrition Vanilla High Protein Shake,2,330ml,Suitable for vegetarians,NA,NA,NA,NA,NA,"Skimmed MILK (77%), water, MILK protein concentrate (6%), flavourings, stabilisers (gellan gum, carrageenan), acidity regulator (trisodium citrate), colour (curcumin), sweetener (sucralose).",,,https://www.ocado.com/productImages/562/562529011_0_150x150.jpg?identifier=e00e221b11ee451a1fa04f3130118175,https://www.ocado.com/products/optimum-nutrition-vanilla-high-protein-shake-562529011,https://www.ocado.com/browse/fresh-chilled-food-20002?hideOOS=true
"Soft Drinks, Tea & Coffee",Birchall Tea,Birchall Great Rift Breakfast Blend Everyday Tea Bags,5,80 per pack,Suitable for vegetarians,NA,United Kingdom,4.3,47,79,Black Tea,,,https://www.ocado.com/productImages/496/496470011_0_150x150.jpg?identifier=3b8fb4e79143134d25c4128645c4b82d,https://www.ocado.com/products/birchall-great-rift-breakfast-blend-everyday-tea-bags-496470011,https://www.ocado.com/browse/soft-drinks-tea-coffee-20977?hideOOS=true
Fresh & Chilled Food,Ocado,Ocado Dried Mango,1.95,100g,Suitable for vegetarians,LIFE 1m+,NA,3.8,48,69,"Dried Mango, Preservative (Sodium Metabisulphite).For allergens, see ingredients in bold.",,,https://www.ocado.com/productImages/253/253862011_0_150x150.jpg?identifier=a9ff220c635cc9047fe789bb5d01adc7,https://www.ocado.com/products/ocado-dried-mango-253862011,https://www.ocado.com/browse/fresh-chilled-food-20002?hideOOS=true
Fresh & Chilled Food,M&S,M&S Collection Roasted Marcona Almonds,3.7,150g,NA,NA,Spain,4.5,22,91,NA,,,https://www.ocado.com/productImages/511/511563011_0_150x150.jpg?identifier=b8e0d723238d6dc52698eb5d8cdf92d6,https://www.ocado.com/products/m-s-collection-roasted-marcona-almonds-511563011,https://www.ocado.com/browse/fresh-chilled-food-20002?hideOOS=true
Fresh & Chilled Food,Lurpak,Lurpak Slightly Salted Spreadable Blend of Butter and Rapeseed Oil,2.25,250g,"Suitable for freezing, Suitable for vegetarians",LIFE 1m+,Denmark,4.7,21,91,"Butter (64%) (Milk), Rapeseed Oil, Water, Lactic Culture (Milk), Salt",,,https://www.ocado.com/productImages/166/16660011_0_150x150.jpg?identifier=161e97d9d4f5e58666f833807667ec30,https://www.ocado.com/products/lurpak-slightly-salted-spreadable-blend-of-butter-and-rapeseed-oil-16660011,https://www.ocado.com/browse/fresh-chilled-food-20002?hideOOS=true
Fresh & Chilled Food,M&S,M&S French Torchon Ham,3.7,160g,NA,LIFE 1w+,France,3.7,3,67,"Pork (90%), Water, Curing Salt (Salt, Preservative: Sodium Nitrite), Pork Stock (Water, Salt, Pork Fat, Onions, Carrots, Pork Bones, Pork, Dried Herbs (Parsley, Bay Leaves), Ground Spices (Black Pepper, Cloves, Garlic), Sea Salt, Dextrose, Antioxidant: E316Allergen Information",,,https://www.ocado.com/productImages/570/570366011_0_150x150.jpg?identifier=a4d274145af5c004af3e5d6d683cd9fb,https://www.ocado.com/products/m-s-french-torchon-ham-570366011,https://www.ocado.com/browse/fresh-chilled-food-20002?hideOOS=true
Bakery,Specialite,Specialite Fingerellas Chocolate,1.6,250g,NA,LIFE 1m+,France,3.5,20,65,"Wheat Flour, Eggs (15%), Rapeseed Oil, Glucose-Fructose Syrup, Sugar, Stabiliser: Sorbitol, Glucose, Chocolate (3.4%) (Sugar, Cocoa Mass, Cocoa Butter, Fat-Reduced Cocoa Powder, Emulsifier: Soya Lecithin; Vanilla Flavouring), Skimmed Milk Powder, Fat-Reduced Cocoa Powder, Salt, Lactose (Milk), Raising Agents: Sodium Hydrogen Carbonate and Disodium Diphosphate, Chocolate Flavouring, Vanilla Flavouring",,,https://www.ocado.com/productImages/396/39620011_0_150x150.jpg?identifier=7ca877a4dcdf20f1d9ba757a7c50bf1e,https://www.ocado.com/products/specialite-fingerellas-chocolate-39620011,https://www.ocado.com/browse/bakery-25189?hideOOS=true
Fresh & Chilled Food,Daylesford,Daylesford Organic Redcurrant Jelly,4,220g,Organic,NA,NA,4.0,4,75,NA,,,https://www.ocado.com/productImages/642/64279011_0_150x150.jpg?identifier=f41097e46e5b8d1f79afc28ad4608d75,https://www.ocado.com/products/daylesford-organic-redcurrant-jelly-64279011,https://www.ocado.com/browse/fresh-chilled-food-20002?hideOOS=true
Fresh & Chilled Food,Natoora,Natoora Italian Broccolo Fiolaro,4,200g,Suitable for vegetarians,LIFE 2d+,Italy,4.7,10,80,NA,,,https://www.ocado.com/productImages/308/308141011_0_150x150.jpg?identifier=3fe75b590dd5b639fbfc3e2ea7d50a99,https://www.ocado.com/products/natoora-italian-broccolo-fiolaro-308141011,https://www.ocado.com/browse/fresh-chilled-food-20002?hideOOS=true
Fresh & Chilled Food,Peperami,Peperami Hot Multipack,2,5 x 22.5g,NA,LIFE 1m+,Germany,3.8,16,82,"Pork, Iodised Salt (Salt, Potassium Iodate), Spices, Dextrose, Pork Fat, Flavour Enhancer (Monosodium Glutamate), Flavourings, Preservative (Sodium Nitrite), Beechwood Smoke",,,https://www.ocado.com/productImages/152/15291011_0_150x150.jpg?identifier=3e00c1319289f2216dfa9c4b4b7d971d,https://www.ocado.com/products/peperami-hot-multipack-15291011,https://www.ocado.com/browse/fresh-chilled-food-20002?hideOOS=true
Fresh & Chilled Food,Alpro,Alpro Soya Long Life Alternative to Single Cream,85,250ml,Suitable for vegetarians,LIFE 1m+,EU,4.7,57,93,"Soya Base (Water, Hulled Soya Beans (5.5%)), Sunflower Oil, Sugar, Emulsifier (Sucrose Esters of Fatty Acids), Stabilisers (Xanthan Gum, Carrageenan Guar Gum), Sea Salt, Flavouring",,,https://www.ocado.com/productImages/167/16799011_0_150x150.jpg?identifier=37faa6acdfe1003ac1dbc8c5d4afe0d0,https://www.ocado.com/products/alpro-soya-long-life-alternative-to-single-cream-16799011,https://www.ocado.com/browse/fresh-chilled-food-20002?hideOOS=true
Fresh & Chilled Food,M&S,M&S Prawn Crackers,1.05,50g,NA,LIFE 3w+,UK,3.0,26,54,"Prawns (Crustacean) (16%), Sunflower Oil, Tapioca Flour, Sugar, Salt, Raising Agent: Sodium Bicarbonate",,,https://www.ocado.com/productImages/509/509092011_0_150x150.jpg?identifier=b2ace8bc529e148844444eb3e8deecbf,https://www.ocado.com/products/m-s-prawn-crackers-509092011,https://www.ocado.com/browse/fresh-chilled-food-20002?hideOOS=true
Bakery,Brindisa,Brindisa Paiarrop Pajarero Fig & Marcona Almond Wheel,5,225g,Suitable for vegetarians,LIFE 1m+,Spain,3.9,7,72,Pajarero Figs (85%) and Marcona Almonds Dietary Information,,,https://www.ocado.com/productImages/374/374420011_0_150x150.jpg?identifier=829159662b2e33587df2dae056a30426,https://www.ocado.com/products/brindisa-paiarrop-pajarero-fig-marcona-almond-wheel-374420011,https://www.ocado.com/browse/bakery-25189?hideOOS=true
Fresh & Chilled Food,Actimel,Actimel Strawberry Drinking Yoghurts,3,8 x 100g,Suitable for vegetarians,LIFE 1w+,NA,4.0,13,85,"Yogurt (Milk), Skimmed Milk, Sugar / Liquid Sugar, Strawberry (2.1%), Dextrose, Milk Minerals, Modified Tapioca Starch, Natural Flavourings, Acidity Regulators (Citric Acid, Sodium Citrate), Lactobacillus Casei (L. Casei Danone®), Vitamins (B6, D)Allergen Information",,,https://www.ocado.com/productImages/247/24716011_0_150x150.jpg?identifier=0a35e1e4675b44626280316c4db09239,https://www.ocado.com/products/actimel-strawberry-drinking-yoghurts-24716011,https://www.ocado.com/browse/fresh-chilled-food-20002?hideOOS=true
Fresh & Chilled Food,PLENISH,Plenish Organic Berry Gut Health Shot,2,60ml,"Organic, Suitable for vegetarians",LIFE 2w+,NA,3.1,34,50,"Pomegranate (40%), Apple, Raspberry (10%), Apple Cider Vinegar (8%), Lime, Bacillus Coagulans**, **Not Organic",,,https://www.ocado.com/productImages/470/470645011_0_150x150.jpg?identifier=efbb28e31010c14ea8527b29c041eb56,https://www.ocado.com/products/plenish-organic-berry-gut-health-shot-470645011,https://www.ocado.com/browse/fresh-chilled-food-20002?hideOOS=true
Fresh & Chilled Food,Liberto,Liberto Organic Dark Chocolate Protein Shake with Sour Cherry Flavouring,15,280g,"Organic, Suitable for vegetarians",NA,Ireland,3.1,14,58,"Pea Protein* (63%), Omega 3 Blend* (Milled Flax Seed*, Milled Chia Seed*) (12%), Coconut Palm Sugar*, Cacao* (6%), Natural Sour Cherry Flavouring (5%), Maca*, Acacia Gum*, Konjac*, Inulin*, Lactospore Bacillus Coagulans, (*Certified Organic Ingredients)Allergen Information",,,https://www.ocado.com/productImages/395/395428011_0_150x150.jpg?identifier=9540f68d31bc83f75bd90139d422a66f,https://www.ocado.com/products/liberto-organic-dark-chocolate-protein-shake-with-sour-cherry-flavouring-395428011,https://www.ocado.com/browse/fresh-chilled-food-20002?hideOOS=true
Fresh & Chilled Food,Soulful,Soulful Thai Red Vegetable Curry With Brown Rice,2.5,380g,"Suitable for the microwave, Suitable for vegetarians",LIFE 5d+,United Kingdom,4.1,22,82,"Coconut Milk (20%) (Coconut Extract, Water), Thai Style Red Curry Paste (15%) (Tomato Passata, Red Pepper, Water, Onion, Red Chilli Purée, Tomato Paste, Lemongrass, Rapeseed Oil, Garlic Purée, Galangal, Ginger Purée, Lime Leaves, Lemon Zest, Chilli Powder, Coriander, Ground Coriander, Cumin), Water, Chargrilled Aubergine (8%), Red Pepper (8%), Sweet Potato (6%), Baby Corn (6%), Carrot, Onion, Brown Rice (5%), Tamari [Water, Soya Beans, Salt, Spirit Vinegar], Lime Juice from Concentrate (1.5%), Sugar, Chopped Coriander, Gluten Free Flour [Rice, Potato, Tapioca, Maize, Buckwheat]Allergen Information",,,https://www.ocado.com/productImages/435/435660011_0_150x150.jpg?identifier=82e769b87c06945655378b58f823bea9,https://www.ocado.com/products/soulful-thai-red-vegetable-curry-with-brown-rice-435660011,https://www.ocado.com/browse/fresh-chilled-food-20002?hideOOS=true
Fresh & Chilled Food,Soli,Soli Aubergine & Mozzarella Ravioli,3.5,250g,Suitable for freezing,NA,Italy,4.1,74,76,"Filling (70%) (Sautéed Aubergine (44%) [Aubergine, Tomato, Olive Oil, Sunflower Oil, Garlic, Salt], Breadcrumbs [Wheat Flour, Yeast, Salt], Mozzarella Cheese (12%) (Cows' Milk), Roasted Tomatoes (8%), Lactose (Cows' Milk), Sunflower Oil, Provolone Cheese (Cows' Milk), Basil Paste [Basil, Sunflower Oil, Salt, Acidity Regulator: Sodium Bicarbonate], Sea Salt, Garlic), Fresh Egg Pasta (30%) (Wheat Flour, Pasteurised Free Range Egg (27%), Durum Wheat Semolina, Tomato Powder)Allergen Information",,,https://www.ocado.com/productImages/320/320867011_0_150x150.jpg?identifier=212a2b4023732deb7dd7688b1d73de4f,https://www.ocado.com/products/soli-aubergine-mozzarella-ravioli-320867011,https://www.ocado.com/browse/fresh-chilled-food-20002?hideOOS=true
Fresh & Chilled Food,Ocado,Ocado Organic 2 Beef Rump Steaks,7.95,Typically: 400g,"Suitable for freezing, Organic",LIFE 5d+,UK,3.5,33,73,NA,,,https://www.ocado.com/productImages/550/550206011_0_150x150.jpg?identifier=785fb852374833f2dd28d1891dccf58e,https://www.ocado.com/products/ocado-organic-2-beef-rump-steaks-550206011,https://www.ocado.com/browse/fresh-chilled-food-20002?hideOOS=true
"Soft Drinks, Tea & Coffee",Clipper,Clipper Organic Everyday Tea Bags,3,100 per pack,Organic,NA,United Kingdom,4.3,103,81,Organically Grown Black Tea,,,https://www.ocado.com/productImages/194/19468011_0_150x150.jpg?identifier=a7e1b67d9c70f55804b3275554174096,https://www.ocado.com/products/clipper-organic-everyday-tea-bags-19468011,https://www.ocado.com/browse/soft-drinks-tea-coffee-20977?hideOOS=true
Fresh & Chilled Food,M&S,M&S Select Farms Outdoor Bred 6 Dry Cured Smoked Back Bacon Rashers,3.4,220g,Suitable for freezing,LIFE 1w+,UK,3.0,41,40,"British Pork (made with 105g of Raw Pork per 100g of Dry Cured Smoked Back Bacon), Curing Salt (Salt, Preservative: Sodium Nitrite, Sodium Nitrate), Demerara Sugar, Sugar, Antioxidant: E301",,,https://www.ocado.com/productImages/505/505500011_0_150x150.jpg?identifier=19e32dc53a4f1fb7e9a8a1d40b0cae85,https://www.ocado.com/products/m-s-select-farms-outdoor-bred-6-dry-cured-smoked-back-bacon-rashers-505500011,https://www.ocado.com/browse/fresh-chilled-food-20002?hideOOS=true
Fresh & Chilled Food,M&S,M&S 2 British Ribeye Steaks,9.2,Typically: 400g,Suitable for freezing,LIFE 6d+,UK,4.0,29,76,NA,,,https://www.ocado.com/productImages/547/547881011_0_150x150.jpg?identifier=790df45925ca77f58e226dc2ce1e282c,https://www.ocado.com/products/m-s-2-british-ribeye-steaks-547881011,https://www.ocado.com/browse/fresh-chilled-food-20002?hideOOS=true
Fresh & Chilled Food,Tropicana,Tropicana Pressed Apple Juice,4.4,1.7L,Suitable for vegetarians,LIFE 1w+,NA,4.5,24,88,"Apple Juice, Antioxidant (Ascorbic Acid)",,,https://www.ocado.com/productImages/237/237340011_0_150x150.jpg?identifier=2c47294c5f5a8a5f81a9f211e25f4c3d,https://www.ocado.com/products/tropicana-pressed-apple-juice-237340011,https://www.ocado.com/browse/fresh-chilled-food-20002?hideOOS=true
Fresh & Chilled Food,M&S,M&S Passion Fruit Swiss Roll,3.4,275g,"Suitable for freezing, Suitable for vegetarians",LIFE 2d+,UK,4.1,99,77,"Whipping Cream (Milk), Sugar, Wheatflour contains Gluten (with Wheatflour, Calcium Carbonate, Iron, Niacin, Thiamin), Pasteurised Egg, Passion Fruit Purée, Cornflour, Dextrose, Raising Agent: E450, Sodium Bicarbonate, Gelling Agent: Pectin (from Fruit), Butter (Milk), Wheat Starch (contains Gluten), Palm Oil, Colour: Paprika Extract, Rapeseed Oil, Stabiliser: E401, Salt",,,https://www.ocado.com/productImages/519/519116011_0_150x150.jpg?identifier=da046f9cc64661a7192feae104b78b95,https://www.ocado.com/products/m-s-passion-fruit-swiss-roll-519116011,https://www.ocado.com/browse/fresh-chilled-food-20002?hideOOS=true
Fresh & Chilled Food,The Vegetarian Butcher,Vegetarian Butcher The Great Escalope,2.5,180g,"Suitable for freezing, Suitable for vegetarians",LIFE 1w+,Netherlands,3.3,39,54,"NEW ingredient list:  Water 27%, plant structure 22,03% (water, SOY protein, WHEAT GLUTEN, corn starch, potato starch), breadcrumbs (WHEAT flour, WHEAT fibre, yeast, salt), vegetable oils (sunflower oil, shea oil, coconut oil), fibres (OAT fibre, Psyllium husk), SOY protein, WHEAT flour, thickener (methyl cellulose (E461)), natural flavouring, potato starch, modified WHEAT starch, spirit vinegar, salt, acid (lactic acid (E270)), white pepper, ferric pyrophosphate, vitamin B12. May contains cereals containing gluten (rye. Barley), celery, milk, mustard, and eggs.Allergen Information",,,https://www.ocado.com/productImages/529/529715011_0_150x150.jpg?identifier=8c411dfced3eb9790a740e592c5202ce,https://www.ocado.com/products/vegetarian-butcher-the-great-escalope-529715011,https://www.ocado.com/browse/fresh-chilled-food-20002?hideOOS=true
Fresh & Chilled Food,Purely Organic,Purely Organic Eggs,2.65,6 per pack,"Organic, Suitable for vegetarians",LIFE 1w+,NA,4.4,24,88,NA,,,https://www.ocado.com/productImages/525/525117011_0_150x150.jpg?identifier=42c5e7641c522cc987df7452aad655d9,https://www.ocado.com/products/purely-organic-eggs-525117011,https://www.ocado.com/browse/fresh-chilled-food-20002?hideOOS=true
Fresh & Chilled Food,Daylesford,Daylesford Organic Plum Compote,4.1,385g,"Organic, Suitable for vegetarians",NA,France,4.6,14,86,"Plum (88%), sugar May contain natural fruit stones",,,https://www.ocado.com/productImages/669/66901011_0_150x150.jpg?identifier=69ae6daa34e19b6b4da4207bad1843c2,https://www.ocado.com/products/daylesford-organic-plum-compote-66901011,https://www.ocado.com/browse/fresh-chilled-food-20002?hideOOS=true
"Soft Drinks, Tea & Coffee",Kenco,Kenco 2 in 1 Smooth White Instant Coffee Sachets,1,5 x 14g,Suitable for vegetarians,NA,NA,3.9,27,86,"Glucose Syrup, Skimmed Milk Powder (15 %), Instant Coffee (9.9 %), Fully Hydrogenated Coconut Oil, Stabilisers (E340, E452), Milk Protein, Emulsifiers (E471, E481), Anti-Caking Agent (E551)Allergen Information",,,https://www.ocado.com/productImages/451/451264011_0_150x150.jpg?identifier=bccb953bedc566ad76df28a5b07613a5,https://www.ocado.com/products/kenco-2-in-1-smooth-white-instant-coffee-sachets-451264011,https://www.ocado.com/browse/soft-drinks-tea-coffee-20977?hideOOS=true
Fresh & Chilled Food,Love Me Tender,Love Me Tender Sugarsnap Peas,3.05,300g,Suitable for vegetarians,LIFE 3d+,"Egypt, Guatemala, India, Jordan, Kenya, Peru, USA, Zambia, Zimbabwe",3.0,25,48,100% Sugarsnap,,,https://www.ocado.com/productImages/487/487189011_0_150x150.jpg?identifier=60037b4da69ce040777f684f516f0e05,https://www.ocado.com/products/love-me-tender-sugarsnap-peas-487189011,https://www.ocado.com/browse/fresh-chilled-food-20002?hideOOS=true
Fresh & Chilled Food,Tropicana,"Tropicana Lean Mixed Berries Apple, Strawberry, & Raspberry",2.5,900ml,Suitable for vegetarians,LIFE 1w+,NA,3.0,29,52,"Fruit Juices and Purees (61%) (Apple (33%), Strawberry (10%), Raspberry (10%), Grape), Water (39%), Natural Flavouring",,,https://www.ocado.com/productImages/532/532073011_0_150x150.jpg?identifier=20f183c56d2c4bc4a09a6931aa33c393,https://www.ocado.com/products/tropicana-lean-mixed-berries-apple-strawberry-raspberry-532073011,https://www.ocado.com/browse/fresh-chilled-food-20002?hideOOS=true
Fresh & Chilled Food,M&S,M&S Spinach & Pine Kernel Pasta Salad,2.3499999999999996,200g,Suitable for vegetarians,LIFE 2d+,UK,3.9,54,78,"Cooked Egg Pasta (66%) (Durum Wheat Semolina (contains Gluten), Water, Pasteurised Egg), Spinach (5%), Sunflower Oil, Basil Infused Sunflower Oil, Basil, Medium Fat Hard Cheese (Milk), Lemon Juice, Vegetarian Pecorino Cheese (Milk), Pine Kernels, Salt, Garlic Purée, Red Wine Vinegar, Ground Black Pepper, Rapeseed Oil",,,https://www.ocado.com/productImages/517/517883011_0_150x150.jpg?identifier=187b21f9628a8fc165eec3977f89bf2e,https://www.ocado.com/products/m-s-spinach-pine-kernel-pasta-salad-517883011,https://www.ocado.com/browse/fresh-chilled-food-20002?hideOOS=true
Fresh & Chilled Food,M&S,M&S Pineapple Perfectly Ripe,1.05,NA,Suitable for vegetarians,LIFE 3d+,NA,3.2,69,54,NA,,,https://www.ocado.com/productImages/518/518241011_0_150x150.jpg?identifier=056c4b12565fca74add573acf25130c9,https://www.ocado.com/products/m-s-pineapple-perfectly-ripe-518241011,https://www.ocado.com/browse/fresh-chilled-food-20002?hideOOS=true
