product_link,badge,ingredient,brand,country,rating,count,recommend
https://www.ocado.com/products/faith-in-nature-grapefruit-orange-shampoo-289234011,Suitable for vegetarians,"Aqua (Water)***, Ammonium Laureth Sulfate*, Maris Sal (Sea Salt), Cocamidopropyl Betaine*, Polysorbate 20*, Chamomilla Recutita (Matricaria) Flower Extract**, Citrus Aurantium Dulcis (Orange) Peel Oil**, Citrus Paradisi (Grapefruit) Peel Oil*, Camellia Sinensis Flower Extract**, Camellia Sinensis Leaf Extract**, Litsea Cubeba Fruit Oil*, Citrus Reticulata (Tangerine) Peel Oil*, Tocopherol*, Glycerin*, Helianthus Annuus (Sunflower) Seed Oil*, Citric Acid*, Sodium Benzoate, Potassium Sorbate, Citral*, Limonene*, Curcumin CI 75300*, *Plant derived, **Organic ingredient, ***Water from the Lake DistrictDietary InformationSuitable for Vegans; Not Tested on Animals",Faith In Nature,England,4.3,31,84
https://www.ocado.com/products/avalon-organics-tea-tree-scalp-treatment-shampoo-84625011,"Organic, Suitable for vegetarians","Aqua (Water), Aloe Barbadensis Leaf Juice(1), Cocamidopropyl Betaine, Sodium Laurylglucosides Hydroxypropylsulfonate, Glycerin, Sodium Cocoyl Isethionate, Stearic Acid, Sodium Lauroyl Sarcosinate, Chamomilla Recutita (Matricaria) Flower Extract(1), Citrus Medica Limonum (Lemon) Peel Extract(1), Rosmarinus Officinalis (Rosemary) Leaf Extract(1), Citrus Aurantium Dulcis (Orange) Oil, Eucalyptus Globulus Leaf Oil, Melaleuca Alternifolia (Tea Tree) Leaf Oil(1), Mentha Arvensis Leaf Oil, Mentha Piperita (Peppermint) Oil, Rosmarinus Officinalis (Rosemary) Leaf Oil, Arginine, Beta-Glucan, Bisabolol, Sodium Citrate, Sodium PCA, Panthenol, Tocopheryl Acetate, Guar Hydroxypropyltrimonium Chloride, Alcohol(1), Benzyl Alcohol, Potassium Sorbate, Sodium Benzoate, Limonene, Linalool.(1)Certified Organic Ingredient",Avalon,USA,3.6,20,60
https://www.ocado.com/products/garnier-ultimate-blends-nourishing-hair-food-banana-shampoo-for-dry-hair-502341011,NA,"Aqua / Water, Sodium Lauryl Sulfate, Coco-Glucoside, Coco-Betaine, Musa Paradisiaca Fruit Juice / Banana Fruit Juice, Cocos Nucifera Oil / Coconut Oil, Carbomer, Glycerin, Glyceryl Oleate, Glycol Distearate, Triethyl Citrate, Lecithin, Sodium Chloride, Sodium Hydroxide, Hydrogenated Palm Glycerides Citrate, Hydroxypropyl Guar Hydroxypropyltrimonium Chloride, Citric Acid, Lactic Acid, Tocopherol, Ascorbyl Palmitate, Potassium Sorbate, Sodium Benzoate, Salicylic Acid, Linalool, Benzyl Alcohol, Parfum / Fragrance, (F.I.L C244837/1)",Garnier,Italy,3.4,7,58
https://www.ocado.com/products/l-oreal-elvive-colour-protect-shampoo-26965011,NA,"1199588 B, Aqua / Water, Sodium Laureth Sulfate, Dimethicone, Coco-Betaine, Sodium Chloride, Glycol Distearate, Guar Hydroxypropyltrimonium Chloride, Cocamide Mipa, Cocos Nucifera Oil / Coconut Oil, Sodium Benzoate, Sodium Hydroxide, Paeonia Albiflora Root Extract, Paeonia Officinalis Flower Extract, Ethylhexyl Salicylate, Salicylic Acid, Fumaric Acid, Benzyl Alcohol, Benzyl Salicylate, Linalool, Alpha-Isomethyl Ionone, Carbomer, Geraniol, Citric Acid, Citronellol, Potassium Sorbate, Hexylene Glycol, Hexyl Cinnamal, Glycerin, Parfum / Fragrance, (F.I.L C241469/1)",L'Oréal Paris,France,4.2,52,89
https://www.ocado.com/products/pantene-hair-biology-full-vibrant-conditioner-488799011,NA,"Aqua, Stearyl Alcohol, Silicone Quaternium-26, Behentrimonium Chloride, Cetyl Alcohol, Isopropyl Alcohol, Parfum, Benzyl Alcohol, Disodium EDTA, Citric Acid, Linalool, Panthenol, Panthenyl Ethyl Ether, Histidine, Hexyl Cinnamal, Butylene Glycol, Hydroxycitronellal, Nelumbo Nucifera Flower Extract, Benzyl Benzoate, Sodium Hydroxide, Magnesium Nitrate, Oleic Acid, Methylchloroisothiazolinone, Magnesium Chloride, Methylisothiazolinone",Pantene,United Kingdom,4.2,25,92
https://www.ocado.com/products/colgate-total-advanced-deep-clean-toothpaste-308769011,Suitable for vegetarians,"Glycerin, Hydrated Silica, Aqua, Sodium Methyl Cocoyl Taurate, Arginine, Aroma, Zinc Oxide, Cellulose Gum, Cocamidopropyl Betaine, Benzyl Alcohol, Zinc Citrate, Tetrasodium Pyrophosphate, Sodium Saccharin, Xanthan Gum, Sodium Fluoride. Contains: Sodium Fluoride Total Fluoride content: 1450 ppm",Colgate,NA,3.6,64,72
https://www.ocado.com/products/oral-b-pro-expert-clean-mint-toothpaste-62656011,NA,"Glycerin, Hydrated Silica, Sodium Hexametaphosphate, Aqua, Sodium Gluconate, Sodium Lauryl Sulfate, Aroma, Carrageenan, Trisodium Phosphate, Stannous Fluoride, Sodium Saccharin, PVP, Stannous Chloride, Xanthan Gum, Cocamidopropyl Betaine, Cinnamal, Sodium Fluoride, Eugenol, Sodium Hydroxide, CI 74160, Sodium Benzoate",Oral-B,Germany,4.0,55,73
https://www.ocado.com/products/colgate-total-advanced-deep-clean-toothpaste-427011011,Suitable for vegetarians,"Glycerin, Hydrated Silica, Aqua, Sodium Lauryl Sulfate, Arginine, Aroma, Zinc Oxide, Cellulose Gum, Poloxamer 407, Zinc Citrate, Tetrasodium Pyrophosphate, Xanthan Gum, Benzyl Alcohol, Cocamidopropyl Betaine, Sodium Fluoride, Sodium Saccharin, Sucralose, CI 77891",Colgate,NA,4.4,37,92
https://www.ocado.com/products/sanex-biome-protect-moisturising-bath-foam-209791011,NA,"Aqua, Glycerin, Cocamidopropyl Betaine, Sodium C14-16 Olefin Sulfonate, Inulin, Sodium Benzoate, Lactic Acid, Parfum, Hydroxyacetophenone, Sodium Pyruvate, Sodium Gluconate, Sodium PCA, Polyquaternium-7, Sucrose Cocoate, Butyloctanol, Lecithin, Zinc Sulfate, Poloxamer 124",Sanex,EU,3.5,4,50
https://www.ocado.com/products/sanex-biome-protect-kids-head-to-toe-wash-55476011,NA,"Aqua, Cocamidopropyl Betaine, Sodium C14-16 Olefin Sulfonate, Inulin, Parfum, Sodium Benzoate, Lactic Acid, Hydroxyacetophenone, Polyquaternium-7, Sodium Pyruvate, Glycol Distearate, Sodium Gluconate, Sodium PCA, Poloxamer 124, Butyloctanol, Coco-Glucoside, Zinc Sulfate, Glyceryl Oleate, Glyceryl Stearate",Sanex,EU,4.4,18,89
https://www.ocado.com/products/sanex-biomeprotect-moisturising-shower-gel-454228011,Suitable for vegetarians,"Aqua, Glycerin, Cocamidopropyl Betaine, Sodium C14-16 Olefin Sulfonate, Inulin, Sodium Benzoate, Lactic Acid, Parfum, Hydroxyacetophenone, Sodium Pyruvate, Polyquaternium-7, Sucrose Cocoate, Butyloctanol, Lecithin, Zinc Sulfate, Poloxamer 124",Sanex,EU,4.5,44,94
https://www.ocado.com/products/imperial-leather-foamburst-bergamot-sea-minerals-456209011,Suitable for vegetarians,"Aqua, Isopentane, Sodium Laureth Sulfate, Lauramine Oxide, Parfum, Acrylates/Steareth-20 Methacrylate Crosspolymer, PEG-200 Hydrogenated Glyceryl Palmate, Limonene, DMDM Hydantoin, PEG-7 Glyceryl Cocoate, Tetrasodium Glutamate Diacetate, Linalool, Lactic Acid, Sodium Hydroxide, Sodium Benzoate, Glycerin, Mentha Aquatica Flower/Leaf/Stem Extract, Propylene Glycol, Maris Sal, Fucus Vesiculosus Extract, Laminaria Digitata Extract, Citrus Aurantium Bergamia Fruit Extract, Potassium Sorbate, CI 42090, CI 47005",Imperial Leather,England,3.9,15,80
https://www.ocado.com/products/sensodyne-repair-and-protect-toothpaste-whitening-deep-repair-561634011,NA,"Glycerin, PEG-8, Hydrated Silica, Calcium Sodium Phosphosilicate (NOVAMIN), Cocamidopropyl Betaine, Sodium Methyl Cocoyl Taurate, Aroma, Titanium Dioxide, Carbomer, Silica, Sodium Saccharin, Sodium Fluoride, Limonene. Contains Sodium Fluoride 0.315% w/w (1450 ppm fluoride). As we are always looking to improve our products, our formulations change from time to time, so please always check the product packaging before use.",Sensodyne,NA,NA,NA,NA
https://www.ocado.com/products/babykind-giant-cotton-pads-68787011,NA,NA,Babykind,NA,4.7,9,89
https://www.ocado.com/products/the-organic-protein-co-madagascan-vanilla-whey-protein-powder-487273011,"Organic, Suitable for vegetarians","Organic whey protein concentrate from organic milk (92.2%), unrefined organic coconut sugar (6.8%), ground organic Bourbon vanilla pods (1%)Dietary InformationGluten Free, No Artificial Additives, Suitable for Vegetarians, Hormone Free, Certified Organic",The Organic Protein Company,UK,4.5,8,88
https://www.ocado.com/products/carex-original-handwash-17750011,NA,"Aqua, Sodium Laureth Sulfate, Cocamidopropyl Betaine, Sodium Chloride, Glycerin, Polyquaternium-7, Parfum, Lactic Acid, Sodium Benzoate, Tetrasodium Glutamate Diacetate, Diethylamino Hydroxybenzoyl Hexyl Benzoate, Ethylhexyl Methoxycinnamate, Hexyl Cinnamal, Limonene, Linalool, Alpa-Isomethyl Ionone, Citronellol, CI 42051Dietary InformationSuitable for Vegans",Carex,United Kingdom,4.4,12,84
https://www.ocado.com/products/colgate-total-advanced-deep-clean-toothpaste-308769011,Suitable for vegetarians,"Glycerin, Hydrated Silica, Aqua, Sodium Methyl Cocoyl Taurate, Arginine, Aroma, Zinc Oxide, Cellulose Gum, Cocamidopropyl Betaine, Benzyl Alcohol, Zinc Citrate, Tetrasodium Pyrophosphate, Sodium Saccharin, Xanthan Gum, Sodium Fluoride. Contains: Sodium Fluoride Total Fluoride content: 1450 ppm",Colgate,NA,3.6,64,72
https://www.ocado.com/products/oral-b-pro-expert-clean-mint-toothpaste-62656011,NA,"Glycerin, Hydrated Silica, Sodium Hexametaphosphate, Aqua, Sodium Gluconate, Sodium Lauryl Sulfate, Aroma, Carrageenan, Trisodium Phosphate, Stannous Fluoride, Sodium Saccharin, PVP, Stannous Chloride, Xanthan Gum, Cocamidopropyl Betaine, Cinnamal, Sodium Fluoride, Eugenol, Sodium Hydroxide, CI 74160, Sodium Benzoate",Oral-B,Germany,4.0,55,73
https://www.ocado.com/products/sensodyne-repair-and-protect-toothpaste-whitening-deep-repair-561634011,NA,"Glycerin, PEG-8, Hydrated Silica, Calcium Sodium Phosphosilicate (NOVAMIN), Cocamidopropyl Betaine, Sodium Methyl Cocoyl Taurate, Aroma, Titanium Dioxide, Carbomer, Silica, Sodium Saccharin, Sodium Fluoride, Limonene. Contains Sodium Fluoride 0.315% w/w (1450 ppm fluoride). As we are always looking to improve our products, our formulations change from time to time, so please always check the product packaging before use.",Sensodyne,NA,NA,NA,NA
https://www.ocado.com/products/l-oreal-elvive-colour-protect-shampoo-26965011,NA,"1199588 B, Aqua / Water, Sodium Laureth Sulfate, Dimethicone, Coco-Betaine, Sodium Chloride, Glycol Distearate, Guar Hydroxypropyltrimonium Chloride, Cocamide Mipa, Cocos Nucifera Oil / Coconut Oil, Sodium Benzoate, Sodium Hydroxide, Paeonia Albiflora Root Extract, Paeonia Officinalis Flower Extract, Ethylhexyl Salicylate, Salicylic Acid, Fumaric Acid, Benzyl Alcohol, Benzyl Salicylate, Linalool, Alpha-Isomethyl Ionone, Carbomer, Geraniol, Citric Acid, Citronellol, Potassium Sorbate, Hexylene Glycol, Hexyl Cinnamal, Glycerin, Parfum / Fragrance, (F.I.L C241469/1)",L'Oréal Paris,France,4.2,52,89
https://www.ocado.com/products/sanex-biome-protect-kids-head-to-toe-wash-55476011,NA,"Aqua, Cocamidopropyl Betaine, Sodium C14-16 Olefin Sulfonate, Inulin, Parfum, Sodium Benzoate, Lactic Acid, Hydroxyacetophenone, Polyquaternium-7, Sodium Pyruvate, Glycol Distearate, Sodium Gluconate, Sodium PCA, Poloxamer 124, Butyloctanol, Coco-Glucoside, Zinc Sulfate, Glyceryl Oleate, Glyceryl Stearate",Sanex,EU,4.4,18,89
https://www.ocado.com/products/colgate-total-advanced-deep-clean-toothpaste-427011011,Suitable for vegetarians,"Glycerin, Hydrated Silica, Aqua, Sodium Lauryl Sulfate, Arginine, Aroma, Zinc Oxide, Cellulose Gum, Poloxamer 407, Zinc Citrate, Tetrasodium Pyrophosphate, Xanthan Gum, Benzyl Alcohol, Cocamidopropyl Betaine, Sodium Fluoride, Sodium Saccharin, Sucralose, CI 77891",Colgate,NA,4.4,37,92
https://www.ocado.com/products/sanex-biomeprotect-moisturising-shower-gel-454228011,Suitable for vegetarians,"Aqua, Glycerin, Cocamidopropyl Betaine, Sodium C14-16 Olefin Sulfonate, Inulin, Sodium Benzoate, Lactic Acid, Parfum, Hydroxyacetophenone, Sodium Pyruvate, Polyquaternium-7, Sucrose Cocoate, Butyloctanol, Lecithin, Zinc Sulfate, Poloxamer 124",Sanex,EU,4.5,44,94
https://www.ocado.com/products/babykind-giant-cotton-pads-68787011,NA,NA,Babykind,NA,4.7,9,89
https://www.ocado.com/products/sanex-biome-protect-moisturising-bath-foam-209791011,NA,"Aqua, Glycerin, Cocamidopropyl Betaine, Sodium C14-16 Olefin Sulfonate, Inulin, Sodium Benzoate, Lactic Acid, Parfum, Hydroxyacetophenone, Sodium Pyruvate, Sodium Gluconate, Sodium PCA, Polyquaternium-7, Sucrose Cocoate, Butyloctanol, Lecithin, Zinc Sulfate, Poloxamer 124",Sanex,EU,3.5,4,50
https://www.ocado.com/products/pantene-hair-biology-full-vibrant-conditioner-488799011,NA,"Aqua, Stearyl Alcohol, Silicone Quaternium-26, Behentrimonium Chloride, Cetyl Alcohol, Isopropyl Alcohol, Parfum, Benzyl Alcohol, Disodium EDTA, Citric Acid, Linalool, Panthenol, Panthenyl Ethyl Ether, Histidine, Hexyl Cinnamal, Butylene Glycol, Hydroxycitronellal, Nelumbo Nucifera Flower Extract, Benzyl Benzoate, Sodium Hydroxide, Magnesium Nitrate, Oleic Acid, Methylchloroisothiazolinone, Magnesium Chloride, Methylisothiazolinone",Pantene,United Kingdom,4.2,25,92
https://www.ocado.com/products/garnier-ultimate-blends-nourishing-hair-food-banana-shampoo-for-dry-hair-502341011,NA,"Aqua / Water, Sodium Lauryl Sulfate, Coco-Glucoside, Coco-Betaine, Musa Paradisiaca Fruit Juice / Banana Fruit Juice, Cocos Nucifera Oil / Coconut Oil, Carbomer, Glycerin, Glyceryl Oleate, Glycol Distearate, Triethyl Citrate, Lecithin, Sodium Chloride, Sodium Hydroxide, Hydrogenated Palm Glycerides Citrate, Hydroxypropyl Guar Hydroxypropyltrimonium Chloride, Citric Acid, Lactic Acid, Tocopherol, Ascorbyl Palmitate, Potassium Sorbate, Sodium Benzoate, Salicylic Acid, Linalool, Benzyl Alcohol, Parfum / Fragrance, (F.I.L C244837/1)",Garnier,Italy,3.4,7,58
https://www.ocado.com/products/slimfast-advanced-vitality-salted-caramel-infusion-10-servings-553772011,Suitable for vegetarians,"Maltodextrin, Soya Protein Isolate, Polydextrose, Soya Bean Oil, Milk Proteins, Natural Flavouring, Colour (Plain Caramel), Thickener (Xanthan Gum), Vitamins and Minerals*, Salt, Emulsifier (Soya Lecithin), Green Tea Extract (0.2%), Sweetener (Sucralose), *Vitamins and Minerals: Magnesium Oxide, Potassium Phosphate, Vitamin C, Iron Pyrophosphate, Zinc Gluconate, Vitamin E, Niacin, Copper Gluconate, Vitamin A, Manganese Sulphate, Sodium Selenite, Biotin, Pantothenic Acid, Chromium Chloride, Vitamin D, Folic Acid, Vitamin K1, Vitamin B6, ThiaminAllergen InformationContains Milk, Contains SoyaDietary InformationSuitable for Vegetarians; No Added Sugar; Gluten free",Slim-Fast,NA,NA,NA,NA
https://www.ocado.com/products/slimfast-advanced-vitality-strawberry-blueberry-burst-vegan-shake-powder-553776011,Suitable for vegetarians,NA,Slim Fast,NA,1.0,1,0
https://www.ocado.com/products/ufit-banana-50g-protein-milkshake-548481011,NA,"Skimmed Milk, Water, Milk Protein, Inulin, Vitamin & Mineral Blend: (Vitamin C, Vitamin E, Selenium and Vitamin D2), Stabilisers: Gellan Gum, Carrageenan, Natural Flavouring, Acidity Regulator: Sodium Citrate, Sweetener: Sucralose, Colour: Beta CaroteneAllergen InformationContains MilkDietary InformationSuitable for Vegetarians; No Added Sugar",UFit,EU,NA,NA,NA
https://www.ocado.com/products/vaseline-intensive-care-aloe-spray-moisturiser-95241011,NA,"Aqua, Isopropyl Myristate, Glycerin, Sorbitan Isostearate, Dimethicone, Polyglyceryl-3 Diisostearate, Phenoxyethanol, Tapioca Starch, Methylparaben, Parfum, Carbomer, Xanthan Gum, Stearic Acid, Propylparaben, Ammonium Acryloyldimethyltaurate/VP Copolymer, Disodium EDTA, Sodium Hydroxide, Petrolatum, Aloe Barbadensis Leaf Juice Powder, Lactic Acid, Benzyl Alcohol, Geraniol, Hexyl Cinnamal, Linalool",Vaseline,Italy,4.2,17,89
https://www.ocado.com/products/aussie-3-minute-miracle-shine-deep-treatment-hair-mask-83290011,NA,"Aqua, Cetyl Alcohol, Stearamidopropyl Dimethylamine, Stearyl Alcohol, Quaternium-18, Parfum, Bis-Aminopropyl Dimethicone, Benzyl Alcohol, Hydroxypropyl Guar, Cetearyl Alcohol, Glyceryl Stearate, Polysorbate 60, Citric Acid, EDTA, Linalool, Benzyl Salicylate, Hexyl Cinnamal, Oleyl Alcohol, Magnesium Nitrate, Butylene Glycol, Fragaria Chiloensis Fruit Extract, Methylchloroisothiazolinone, Magnesium Chloride, Methylisothiazolinone",Aussie,United Kingdom,3.4,5,60
https://www.ocado.com/products/boostball-keto-kookie-mix-571223011,Suitable for vegetarians,"Almond Flour, Erythritol, Chocolate Chips (Cocoa Butter (48%), Rice Powder (Rice Syrup, Rice Starch, Rice Flour) (38%), Sugar, Natural Flavouring) (13%), Mct Coconut Powder, Baking Powder, Xanthan GumProduct detailsSpecificationsCBDLow CarbLow sugar,High in proteinKetoVegan Store in a cool dry place. ",Boostball,NA,5.0,2,100
https://www.ocado.com/products/childs-farm-tangerine-bedtime-bubbles-571563011,"Organic, Suitable for vegetarians","Aqua (Water), Sodium Coco-Sulfate, Cocamidopropyl Betaine, Decyl Glucoside, Benzyl Alcohol, Coco-Glucoside, Glycerin, Sodium Chloride, Citric Acid, Limonene, Sodium Lauryl Glucose Carboxylate, Lauryl Glucoside, Parfum (Fragrance), Dehydroacetic Acid, Sodium Benzoate, Sodium Citrate, Citral, Sorbic Acid, Citrus Reticulata (Tangerine) Peel Oil*, Sodium Hydroxide, (*Denotes Certified Organic Ingredient)Dietary InformationNot Tested on Animals; Suitable for Vegans",Childs Farm,United Kingdom,NA,NA,NA
https://www.ocado.com/products/colgate-max-white-expert-anti-stain-whitening-toothpaste-500652011,Suitable for vegetarians,"Glycerin, Propylene Glycol, Calcium Pyrophosphate, PEG/PPG-116/66 Copolymer, PVP, PEG-12, Pentasodium Triphosphate, Sodium Lauryl Sulfate, Silica, Aroma, Sodium Monofluorophosphate, Disodium Pyrophosphate, Sodium Saccharin, Hydrogen Peroxide, Benzyl Alcohol ,Eugenol, Limonene, CI 74160Contains: Sodium MonofluorophosphateTotal Fluoride content: 1450 ppm",Colgate,Poland,3.2,20,60
https://www.ocado.com/products/colgate-total-advanced-sensitive-care-toothpaste-75ml-575931011,NA,"Glycerin, Aqua, Hydrated Silica, Sodium Methyl Cocoyl Taurate, Arginine, Aroma, Zinc Oxide, Cocamidopropyl Betaine, Benzyl Alcohol, Xanthan Gum, Cellulose Gum, Zinc Citrate, Tetrasodium Pyrophosphate, Sodium Saccharin, Sodium Fluoride, Phosphoric Acid. Contains: Sodium Fluoride Total Fluoride content: 1450 ppm",Colgate - Total,Poland,NA,NA,NA
https://www.ocado.com/products/dentek-plant-based-dental-cross-flossers-556558011,NA,NA,DenTek,China,3.0,4,75
https://www.ocado.com/products/dove-derma-spa-summer-revived-fair-to-medium-gradual-self-tan-293795011,NA,"‎Ingredients:Aqua, Glycerin, Isopropyl Palmitate, Stearic Acid, Dihydroxyacetone, Dimethicone, Glycol Stearate, PEG-100 Stearate, Hydroxyethyl Acrylate/Sodium Acryloyldimethyl Taurate Copolymer, Glyceryl Stearate, Caprylyl Glycol, Sodium Hydroxypropyl Starch Phosphate, Phenoxyethanol, Isohexadecane, Parfum, Cetyl Alcohol, Citric Acid, Polysorbate 60, Dimethiconol, Disodium EDTA, Stearamide AMP, Sorbitan Isostearate, Caramel, Maltodextrin, Hydroxystearic Acid, Palmitic Acid, Sodium Chloride, Sodium Sulfate, Alpha-Isomethyl Ionone, Benzyl Alcohol, Citronellol, Coumarin, Geraniol, Hexyl Cinnamal, Limonene, Linalool, CI 16255, CI 47005",Dove,Germany,3.9,33,79
https://www.ocado.com/products/e45-rich-24h-moisturiser-lotion-for-dry-skin-pump-421464011,NA,"Aqua, Glycerin, Paraffinum Liquidum, Sodium Gluconate, Dimethicone, Niacinamide, Cetearyl Alcohol, Oryza Sativa Starch, Glyceryl Stearate, Phenoxyethanol, PEG-40 Stearate, Ceteareth-20, Tocopherol Acetate, Xanthan Gum, Ethylhexylglycerin, Oenothera Biennis Oil, Magnesium Aluminium Silicate, Citric Acid, Tocopherol, Ascorbyl Palmitate, Titanium Dioxide",E45,NA,4.0,3,67
https://www.ocado.com/products/glo-bamboo-incontinence-pads-for-sensitive-bladder-normal-502485011,Suitable for vegetarians,NA,Glo,NA,3.8,45,83
https://www.ocado.com/products/john-frieda-colour-protecting-moisturising-shampoo-brilliant-brunette-370780011,NA,"Aqua, Sodium Laureth Sulfate, Glycerin, Cocamidopropyl Betaine, Coco-Glucoside Glycol Distearate, Cetyl Alcohol, Sodium Lauryl Sulfate, Parfum, Lauric Acid, Polyquaternium-10, Sodium Chloride, PPG-9, Dimethicone, Benzyl Alcohol, Caramel, Hydroxycetyl Hydroxyethyl Dimonium Chloride, Disodium EDTA, Malic Acid, PEG-12 Dimethicone, Glycine, Prunus Amygdalus Dulcis Oil, Pearl Powder, Stearoxypropyl Dimethylamine, C14-28 Isoalkyl Acid, Laureth-4, Laureth-23, C14-28 Alkyl Acid, Methylchloroisothiazolinone, Stearyl Alcohol, Methylisothiazolinone, Sodium Hydroxide, Limonene, Butylphenyl Methylpropional, Hydroxycitronellal",John Frieda,EU,NA,NA,NA
https://www.ocado.com/products/john-frieda-frizz-ease-dream-curls-air-dry-waves-styling-foam-274733011,NA,"Aqua, Cocamidopropyl Betaine, Silicone Quaternium-16/Glycidoxy Dimethicone Crosspolymer, Polysorbate 20, Coco-Glucoside, VP/Methacrylamide/Vinyl Imidazole Copolymer, Undeceth-11, Undeceth-5, Polyquaternium-72, Parfum, Propylene Glycol, Disodium EDTA, Caprylhydroxamic Acid, Malic Acid, Benzyl Alcohol, Methylpropanediol, Acetic Acid, Rosa Canina Fruit Oil, Phenylpropanol, Propanediol, Caprylyl Glycol, Sodium Hydroxide, Tocopherol, Phenoxyethanol, Sodium Benzoate, Benzyl Salicylate, Hexyl Cinnamal, LinaloolDietary InformationSuitable for Vegans; Not Tested on Animals",John Frieda,Germany,3.5,8,63
https://www.ocado.com/products/l-oreal-hairspray-elnett-care-for-dry-damaged-hair-strong-hold-argan-shine-280943011,NA,"1157867 C, Alcohol Denat., Dimethyl Ether, Aqua / Water, Polyurethane-6, Hydroxycitronellal, Argania Spinosa Kernel Oil, Dimethicone, Limonene, Linalool, Benzyl Alcohol, Benzyl Benzoate, Alpha-Isomethyl Ionone, Geraniol, Citronellol, Coumarin, Glycerin, Amyl Cinnamal, Parfum / Fragrance, (F.I.L. C240456/1)",L'Oréal Paris,France,4.7,3,100
https://www.ocado.com/products/l-oreal-paris-hyaluronic-acid-make-up-remover-572241011,NA,"Aqua / Water, Isododecane, Isopropyl Palmitate, C15-19 Alkane, Potassium Phosphate, Sodium Chloride, Hexylene Glycol, Dipotassium Phosphate, Disodium EDTA, Polyaminopropyl Biguanide, Octyldodecanol, Octyldodecyl Xyloside, Arginine, Citric Acid, Sodium Hyaluronate, CI 60725 / Violet 2, (F.I.L. Z286323/1)",L'Oreal Paris,Poland,NA,NA,NA
https://www.ocado.com/products/m-s-natures-ingredients-hand-cream-coconut-almond-531411011,NA,Aqua ∙ Cetearyl Alcohol ∙ Stearic Acid ∙ Paraffinum Liquidum ∙ Ceteareth-20 ∙ Glyceryl Stearate ∙ PEG-100 Stearate ∙ Sorbitol ∙ Parfum ∙ Polysorbate 20 ∙ Carbomer ∙ Propylene Glycol ∙ Cocos Nucifera (Coconut) Fruit Extract ∙ Prunus Amygdalus Dulcis (Sweet Almond) Seed Extract ∙ Disodium EDTA ∙ Sodium Hydroxide ∙ Benzyl Alcohol ∙ Coumarin ∙ Phenoxyethanol ∙ Methylparaben ∙ Propylparaben.Product detailsSpecificationsThis product has not been tested on animals,M&S,NA,NA,NA,NA
https://www.ocado.com/products/natures-aid-echineeze-echinacea-70mg-tablets-252047011,Suitable for vegetarians,Each tablet contains 70mg of dry ethanolic extract equivalent to 460 – 530mg Echinacea purpurea root. It also contains other non-active ingredients. These ingredients are: Herbal extract: Maltodextrin; Silica colloidal hydrated. Tablet core: Calcium hydrogen phosphate dihydrate; Cellulose microcrystalline; Silica colloidal hydrated; Crosscarmellose sodium andMagnesium stearate.Dietary InformationSuitable for Vegetarians & Vegans.,Natures Aid,NA,5.0,3,100
https://www.ocado.com/products/natures-aid-turmeric-8200mg-421395011,Suitable for vegetarians,"Turmeric Root Extract, Turmeric Whole Herb Prep, Vegetable Capsule Shell (Cellulose)Dietary InformationThis product is Free from: Artificial Flavours, Colours & Preservatives, Lactose, Yeast & Gluten.  Suitable for vegetarians and vegans.",Natures Aid,United Kingdom,NA,NA,NA
https://www.ocado.com/products/neal-s-yard-rose-geranium-shower-gel-59504011,NA,"Aqua (Water), Cocamidopropyl Betaine, Lauryl Glucoside, Sodium Cocoamphoacetate, Rosa Damascena (Rose) Flower Oil*, Pelargonium Graveolens (Geranium) Flower Oil*, Canaga Odorata (Ylang Ylang) Flower Oil*, Citrus Limonum (Lemon) Peel Oil Expressed*, Rosa Canina (Rosehip) Fruit Extract*, Panthenol, Sodium Olive Amphoacetate, Levulinic Acid, Glycerin, Alcohol Denat., Benzyl Alcohol, Benzyl Benzoate, Benzyl Salicylate, Citral, Citronellol, Eugenol, Farnesol, Geraniol, Isoeugenol, Limonene, Linalool,*Organically produced ingredient. Natural constituent of Essential Oils listed. Made with 65% organic ingredients.",Neal's Yard Remedies,England,4.0,27,75
https://www.ocado.com/products/radox-detox-therapy-bath-salts-487394011,NA,"Maris Sal, Propylene Glycol, Parfum, Disodium EDTA, Sodium Chloride, CI 14720, CI 19140, CI 42090",Radox,Germany,4.1,27,82
https://www.ocado.com/products/sanex-dermo-care-roll-on-deodorant-403342011,NA,"Aqua, Aluminum Chlorohydrate, Glycerin, PPG-15 Stearyl Ether, Steareth-2, Dimethicone, Steareth-21, Parfum, Caprylyl Glycol, Allantoin, Calcium Silicate, Caprylic/Capric Triglyceride, Cocoglycerides",Sanex,EU,3.0,2,50
https://www.ocado.com/products/scholl-fungal-nail-treatment-kit-69825011,NA,NA,Scholl,NA,4.1,8,75
https://www.ocado.com/products/seven-seas-omega-3-fish-oil-with-vitamin-d-30-capsules-562524011,NA,"Fish Oil, Capsule Shell (Beef Gelatin, Humectant: Glycerol), DL-Alpha-Tocopheryl Acetate (Vitamin E), Medium Chain Triglycerides, Cholecalciferol (Vitamin D)Allergen InformationContains Fish",Seven Seas,NA,NA,NA,NA
https://www.ocado.com/products/simple-antibac-face-wash-558569011,NA,"Aqua, Sodium Laureth Sulfate, Glycerin, Cocamidopropyl Betaine, Sodium Chloride, Sodium Benzoate, Citric Acid, Niacinamide, Sodium Ascorbyl Phosphate, Panthenol",Simple,Poland,5.0,1,100
