category,brand,product,price,weight,badge,shelf_life,country,rating,num_of_reviews,recommend,ingredient,reviews,nutrition,image_link,product_link,category_link
Fresh & Chilled Food,Ocado,Ocado Organic Sweet Potatoes,2.5,750g,"Suitable for the microwave, Organic, Suitable for vegetarians",LIFE 5d+,"Egypt, Portugal",3.2,118,61,NA,,,https://www.ocado.com/productImages/323/323658011_0_150x150.jpg?identifier=efa74e6e1abb3c7f9c294725f92df2ec,https://www.ocado.com/products/ocado-organic-sweet-potatoes-323658011,https://www.ocado.com/browse/fresh-chilled-food-20002?hideOOS=true
"Soft Drinks, Tea & Coffee",Twinings,Twinings Superblends Digest Tea with Ginger & Turmeric,2.9899999999999998,20 per pack,Suitable for vegetarians,NA,NA,NA,NA,NA,"Turmeric (45%), Lemongrass, Ginger Root (10%), Roasted Chicory Root, Natural Fig Flavouring with other Natural Flavourings (7%), Cinnamon Bark, Cloves, Natural Flavouring",,,https://www.ocado.com/productImages/574/574703011_0_150x150.jpg?identifier=324cc7ab19496f50b1dc505f7aca2e13,https://www.ocado.com/products/twinings-superblends-digest-tea-with-ginger-turmeric-574703011,https://www.ocado.com/browse/soft-drinks-tea-coffee-20977?hideOOS=true
Fresh & Chilled Food,Lurpak,Lurpak Olive Spreadable Blend of Butter Olive Oil and Rapeseed Oil,3.25,500g,Suitable for vegetarians,LIFE 2w+,Denmark,4.1,20,75,"Butter (37%) (Milk), Water, Olive Oil (15%), Rapeseed Oil (15%), Lactic Culture (Milk), Salt",,,https://www.ocado.com/productImages/668/66827011_0_150x150.jpg?identifier=c57ba6190887ce8a6bd8d21b4b1d24a2,https://www.ocado.com/products/lurpak-olive-spreadable-blend-of-butter-olive-oil-and-rapeseed-oil-66827011,https://www.ocado.com/browse/fresh-chilled-food-20002?hideOOS=true
Fresh & Chilled Food,Hawksmoor,HAWKSMOOR British Beef Dripping,1.8,200g,Suitable for freezing,LIFE 1m+,NA,4.6,8,88,NA,,,https://www.ocado.com/productImages/546/546551011_0_150x150.jpg?identifier=3d0927b22cc953f7977a7b89119268a2,https://www.ocado.com/products/hawksmoor-british-beef-dripping-546551011,https://www.ocado.com/browse/fresh-chilled-food-20002?hideOOS=true
"Soft Drinks, Tea & Coffee",Caffe Nero,Caffe Nero Single Origin Guatemala Coffee Beans,4.45,200g,Suitable for vegetarians,NA,NA,NA,NA,NA,NA,,,https://www.ocado.com/productImages/565/565134011_0_150x150.jpg?identifier=45bb68ecf0243323238ea64428b8d64e,https://www.ocado.com/products/caffe-nero-single-origin-guatemala-coffee-beans-565134011,https://www.ocado.com/browse/soft-drinks-tea-coffee-20977?hideOOS=true
Fresh & Chilled Food,Oatly,Oatly Oat Drink Chocolate Long Life,1.5,1L,Suitable for vegetarians,LIFE 1m+,NA,4.7,134,92,"Oat Base (Water, Oats 10%), Sugar 3,5%, Cocoa Powder 1%, Rapeseed Oil, Calcium Carbonate, Calcium Phosphates, Salt, Flavourings, Vitamins (D2, Riboflavin, B12), Potassium Iodide",,,https://www.ocado.com/productImages/413/41334011_0_150x150.jpg?identifier=3fc5b0b9522376b8cbed24097c4695ea,https://www.ocado.com/products/oatly-oat-drink-chocolate-long-life-41334011,https://www.ocado.com/browse/fresh-chilled-food-20002?hideOOS=true
"Soft Drinks, Tea & Coffee",SodaStream,SodaStream Classics Diet Tonic,4,440ml,NA,NA,Israel,3.4,14,65,"Water, Acid (Citric Acid), Natural Flavourings, Acidity Regulator (Tri Sodium Citrate), Sweeteners (Stevoil Glycosides, Sucralose), Preservative (Potassium Sorbate), Flavouring (Quinine)Dietary Information",,,https://www.ocado.com/productImages/293/293933011_0_150x150.jpg?identifier=96655a5cd6a0935b78dab0adea43b80b,https://www.ocado.com/products/sodastream-classics-diet-tonic-293933011,https://www.ocado.com/browse/soft-drinks-tea-coffee-20977?hideOOS=true
Bakery,Graze,Graze Salted Caramel Wow Bake,2.7,5 per pack,Suitable for vegetarians,LIFE 1m+,NA,2.3,121,24,"Wheat Flour, Chicory Root Fibre, Wheat Fibre, Humectant: Glycerol, Sugar, Vegetable Oils (Palm*, Rapeseed, Coconut), Caramel Pieces with Salted Butter (5%) (Sugar, Condensed Skimmed Milk, Glucose Syrup, Salted Butter (Milk), Emulsifier: Mono- and Diglycerides of Fatty Acids), Caramel and Chocolate Flavoured Drizzle (5%) (Sugar, Vegetable Fat [Palm* Kernel], Fat Reduced Cocoa Powder, Whey Powder (Milk), Skimmed Milk Powder, Emulsifier: Soy Lecithin, Natural Flavourings), Cocoa Powder (5%), Free Range Egg White Powder, Raising Agent: Sodium Bicarbonate, Almonds, Pumpkin Seeds, Emulsifier: Rapeseed Lecithin, Caramelised Sugar Powder, Thickeners: Xanthan Gum, Locust Bean Gum, Salt, Cane Molasses, Natural Flavouring, *Graze contributes to the production of certified sustainable Palm Oil",,,https://www.ocado.com/productImages/548/548853011_0_150x150.jpg?identifier=4ff4e6ae15771da23a8201e0720aaee6,https://www.ocado.com/products/graze-salted-caramel-wow-bake-548853011,https://www.ocado.com/browse/bakery-25189?hideOOS=true
Bakery,Cadbury,Cadbury Mini Rolls Raspberry Family Size,1.5,10 per pack,Suitable for freezing,NA,NA,4.6,32,94,"Milk Chocolate (32%) [Sugar, Cocoa Mass, Cocoa Butter, Dried Skimmed Milk, Milk Fat, Vegetable Fat (Palm), Dried Whey (from Milk), Emulsifier (Soya Lecithin)], Vanilla Flavour Filling (19%) [Vegetable Oils (Palm, Rapeseed), Glucose Syrup, Dextrose, Sugar, Water, Emulsifier (E471), Flavouring], Plum and Raspberry Jam (13%) [Glucose-Fructose Syrup, Plum Purée, Sugar, Raspberry Purée, Gelling Agent (Pectin), Acid (Citric Acid), Acidity Regulator (Sodium Citrates), Colour (Anthocyanins), Preservative (Potassium Sorbate), Flavouring], Wheat Flour (with added Calcium, Iron, Niacin, Thiamin), Sugar, Water, Humectant (Glycerol), Dried Whole Egg, Vegetable Oils (Palm, Rapeseed), Raising Agents (E450, Sodium Bicarbonate), Soya Flour, Dried Whey (from Milk), Dried Egg White, Emulsifier (E471), Salt, Preservative (Potassium Sorbate)Allergen Information",,,https://www.ocado.com/productImages/360/360943011_0_150x150.jpg?identifier=d9eba0aa65b60928a4f68161ebcbe3c5,https://www.ocado.com/products/cadbury-mini-rolls-raspberry-family-size-360943011,https://www.ocado.com/browse/bakery-25189?hideOOS=true
Bakery,M&S,M&S Indulgent Chocolate Fudge Cake,7.35,775g,NA,LIFE 3d+,United Kingdom,4.2,18,84,"Pasteurised Egg, Wheatflour contains Gluten (with Wheatflour, Calcium Carbonate, Iron, Niacin, Thiamin), Belgian Dark Chocolate (9%) (Sugar, Cocoa Mass, Cocoa Butter, Emulsifier: Soya Lecithin, Vanilla Flavouring), Whipping Cream (Milk), Glucose Syrup, Sugar, Belgian Milk Chocolate (7%) (Sugar, Cocoa Mass, Cocoa Butter, Dried Whole Milk, Dried Skimmed Milk, Emulsifier: Soya Lecithin, Vanilla Flavouring), Rapeseed Oil, Dextrose, Humectant: Glycerol, Invert Sugar Syrup, Fat Reduced Cocoa Powder, Butter (Milk), Cocoa Mass, Single Cream (Milk), Butter Oil (Milk), Emulsifier: E472b, E481, E471, E475, Dried Skimmed Milk, Raising Agent: Sodium Bicarbonate, E450, Rowan Extract, Salt, Cornflour, Palm Oil, Vanilla Flavouring",,,https://www.ocado.com/productImages/568/568490011_0_150x150.jpg?identifier=c5c0465585b6cf5933b27f8da9a18938,https://www.ocado.com/products/m-s-indulgent-chocolate-fudge-cake-568490011,https://www.ocado.com/browse/bakery-25189?hideOOS=true
Fresh & Chilled Food,M&S,M&S Seafood Gratin,8.950000000000001,430g,Suitable for freezing,LIFE 3d+,United Kingdom,3.5,16,57,"Cod (Fish) (16%), Whole Milk, Salmon (Fish) (10%), Smoked Haddock (10%) (Haddock (Fish) (98%), Salt, Colour: Curcumin, Paprika Extract), Peeled King Prawns (Crustacean) (9%), Whipping Cream (Milk), Gruyère Cheese (Milk) (5%), Scallops (Mollusc) (5%), Water, Wheatflour contains Gluten (with Wheatflour, Calcium Carbonate, Iron, Niacin, Thiamin), Unsalted Butter (Milk), Cheddar Cheese (Milk) (3%), Onions, Parsley, Cornflour, Rapeseed Oil, Lemon Juice, Dijon Mustard (Water, Mustard Seeds, Vinegar, Salt), Dried Sourdough (Wheatgerm (contains Gluten), Wheatflour (contains Gluten)), Garlic Purée, Salt, Yeast, Ground White Pepper",,,https://www.ocado.com/productImages/568/568991011_0_150x150.jpg?identifier=f3d8ce33baa3332eec30d89b97b05877,https://www.ocado.com/products/m-s-seafood-gratin-568991011,https://www.ocado.com/browse/fresh-chilled-food-20002?hideOOS=true
Fresh & Chilled Food,Dell' Ugo,Dell'Ugo Limoncello Posset,3.5,2 x 100g,Suitable for vegetarians,LIFE 6d+,NA,3.0,60,47,"Double Cream (Milk), Whipping Cream (Milk), Caster Sugar, Lemon Juice, Limoncello (Water, Alcohol, Sugar, Lemon Peel infusion, Natural Flavourings), Pasteurised Free Range Egg, Unsalted Butter (Milk), Pasteurised Free Range Egg Yolk, Chocolate Scroll (Sugar, Cocoa Butter, Milk Powder, Cocoa Lactose (Milk), Whey Powder (Milk), Soy Lecithin, Vanilla Flavour)Allergen Information",,,https://www.ocado.com/productImages/561/561612011_0_150x150.jpg?identifier=422565a467391863c015e29eb65319f9,https://www.ocado.com/products/dell-ugo-limoncello-posset-561612011,https://www.ocado.com/browse/fresh-chilled-food-20002?hideOOS=true
Fresh & Chilled Food,M&S,M&S Scottish 2 Loch Trout Fillets,5,220g,Suitable for freezing,LIFE 3d+,NA,3.6,15,60,NA,,,https://www.ocado.com/productImages/505/505326011_0_150x150.jpg?identifier=3e7a6aea7a7a8db616e769d2e7a435b6,https://www.ocado.com/products/m-s-scottish-2-loch-trout-fillets-505326011,https://www.ocado.com/browse/fresh-chilled-food-20002?hideOOS=true
Fresh & Chilled Food,Ocado,Ocado Sliced Runner Beans,2.9499999999999997,300g,Suitable for vegetarians,LIFE 2d+,Kenya,2.9,111,57,NA,,,https://www.ocado.com/productImages/535/53524011_0_150x150.jpg?identifier=20ab3f497522107b827c11dd96dadb39,https://www.ocado.com/products/ocado-sliced-runner-beans-53524011,https://www.ocado.com/browse/fresh-chilled-food-20002?hideOOS=true
Fresh & Chilled Food,DAYLESFORD ORGANIC,Daylesford Organic Natural Yoghurt,2.75,450ml,Organic,LIFE 1w+,UK,4.1,34,71,"Whole Milk (93%), Skimmed Milk Powder (5%), Cultures*, *Non Organic",,,https://www.ocado.com/productImages/359/359201011_0_150x150.jpg?identifier=d01ec3906a8f2fd62c46f2d7a2344087,https://www.ocado.com/products/daylesford-organic-natural-yoghurt-359201011,https://www.ocado.com/browse/fresh-chilled-food-20002?hideOOS=true
Fresh & Chilled Food,Moy Park,Moy Park 2 Garlic Chicken Kievs,1.93,260g,Suitable for freezing,LIFE 4d+,"UK, EU",3.2,120,60,"Chicken (54%), Breadcrumb (Fortified Wheat Flour (Wheat Flour, Calcium Carbonate, Iron, Niacin, Thiamin), Yeast, Salt), Water, Margarine (Palm Oil, Rapeseed Oil, Water, Emulsifier: Mono- and Di-Glycerides of Fatty Acids, Sunflower Oil, Colour: Beta-Carotene), Unsalted Butter (Milk), Fortified Wheat Flour (Wheat Flour, Calcium Carbonate, Iron, Niacin, Thiamin), Rapeseed Oil, Garlic Purée, Parsley, Salt, Paprika Powder, Concentrated Vinegar Powder, Concentrated Lemon Juice, Black Pepper, Garlic Extract, Sunflower Oil, Rosemary Extract",,,https://www.ocado.com/productImages/988/98832011_0_150x150.jpg?identifier=3c63936af884f7a97ba2f1ea5896c6c8,https://www.ocado.com/products/moy-park-2-garlic-chicken-kievs-98832011,https://www.ocado.com/browse/fresh-chilled-food-20002?hideOOS=true
"Soft Drinks, Tea & Coffee",Dolce Gusto,STARBUCKS Latte Macchiato Coffee Pods by NESCAFE Dolce Gusto,4,12 per pack,NA,NA,NA,3.1,12,34,"Whole Milk Powder (90%), Sugar (10%)Allergen Information",,,https://www.ocado.com/productImages/457/457855011_0_150x150.jpg?identifier=6052e4525bc52f5a4c7c906320784104,https://www.ocado.com/products/starbucks-latte-macchiato-coffee-pods-by-nescafe-dolce-gusto-457855011,https://www.ocado.com/browse/soft-drinks-tea-coffee-20977?hideOOS=true
Fresh & Chilled Food,DAYLESFORD ORGANIC,Daylesford Organic Grape Juice,4.3,750ml,Organic,LIFE 3w+,France,3.8,17,71,Grape Juice (100%),,,https://www.ocado.com/productImages/502/50212011_0_150x150.jpg?identifier=d6f4e6c42567f6e26648806f8249a3b2,https://www.ocado.com/products/daylesford-organic-grape-juice-50212011,https://www.ocado.com/browse/fresh-chilled-food-20002?hideOOS=true
Fresh & Chilled Food,President,President Creme de Brie Cheese Spread,1.6,125g,NA,LIFE 3w+,France,3.6,101,60,"President Brie Cheese (55%) (Milk), Reconstituted Skimmed Milk, Butter (Milk), Milk Proteins, Emulsifying Salts (E339, E452), Thickeners (Xanthan Gum, Carob Seeds Flour), Preservative (Potassium Sorbate)Allergen Information",,,https://www.ocado.com/productImages/862/86245011_0_150x150.jpg?identifier=80b3b5f4cedbdc5add994bd009cb4413,https://www.ocado.com/products/president-creme-de-brie-cheese-spread-86245011,https://www.ocado.com/browse/fresh-chilled-food-20002?hideOOS=true
Fresh & Chilled Food,Jolly Hog,The Jolly Hog Little Porker Chipolata Sausages,2.75,340g,Suitable for freezing,LIFE 4d+,United Kingdom,4.2,68,80,"British Outdoor Bred, RSPCA Assured Pork (84%), Water, Gluten Free Breadcrumb (Rice Flour, Water, Dextrose Monohydrate, Vegetable Fibre, Salt, Mono and Di- Glycerides of Fatty Acids, Caramelised Sugar Syrup, Paprika Extract), Salt, Rubbed Sage, Spices (Black Pepper, White Pepper), Stabiliser (Diphosphates), Preservative (Sodium Metabisulphite), Antioxidant (Ascorbic Acid), Filled into natural Sheep casings",,,https://www.ocado.com/productImages/298/298605011_0_150x150.jpg?identifier=f4ffa5c6a94509bbf1477cf47bfb9eef,https://www.ocado.com/products/the-jolly-hog-little-porker-chipolata-sausages-298605011,https://www.ocado.com/browse/fresh-chilled-food-20002?hideOOS=true
Fresh & Chilled Food,M&S,M&S Montagnolo Affine,3.15,160g,NA,LIFE 1w+,Germany,4.8,19,85,NA,,,https://www.ocado.com/productImages/553/553683011_0_150x150.jpg?identifier=95cd1da41a731564e79f5d7d6b0d06f1,https://www.ocado.com/products/m-s-montagnolo-affine-553683011,https://www.ocado.com/browse/fresh-chilled-food-20002?hideOOS=true
"Soft Drinks, Tea & Coffee",Birchall Tea,Birchall Darjeeling - 15 Prism Tea Bags,4.99,15 per pack,Suitable for vegetarians,NA,NA,3.8,31,75,"Black Tea from Darjeeling, India (100%)",,,https://www.ocado.com/productImages/520/520328011_0_150x150.jpg?identifier=1ffdab43d7389fe5ecad948632522e22,https://www.ocado.com/products/birchall-darjeeling-15-prism-tea-bags-520328011,https://www.ocado.com/browse/soft-drinks-tea-coffee-20977?hideOOS=true
Fresh & Chilled Food,Bio & Me,Bio&Me Original Gut-Loving Prebiotic Yoghurt,1.35,350g,NA,LIFE 1w+,United Kingdom,4.5,12,92,"Yoghurt (Milk) Fermented with 18 Different Live and Active Cultures, Chicory Root Fibre",,,https://www.ocado.com/productImages/564/564660011_0_150x150.jpg?identifier=07a3855a26ecca0474d3b0bfe1d93f92,https://www.ocado.com/products/bio-me-original-gut-loving-prebiotic-yoghurt-564660011,https://www.ocado.com/browse/fresh-chilled-food-20002?hideOOS=true
Fresh & Chilled Food,Robinsons,Robinsons Real Fruit Peach & Mango,1.25,500ml,Suitable for vegetarians,NA,NA,2.5,4,75,"Water, Fruit Juices from Concentrate (Peach 6%, Mango 3%), Acid (Citric Acid), Natural Peach Flavouring with other Natural Flavourings, Acidity Regulator (Sodium Citrate), Natural Colour (Carotenes), Carrot and Apple Concentrate, Antioxidant (Ascorbic Acid), Sweeteners (Sucralose, Acesulfame K), Stabiliser (Cellulose Gum)Dietary Information",,,https://www.ocado.com/productImages/564/564173011_0_150x150.jpg?identifier=257f1a5a6cbe143a7a40ca9ad11acde9,https://www.ocado.com/products/robinsons-real-fruit-peach-mango-564173011,https://www.ocado.com/browse/fresh-chilled-food-20002?hideOOS=true
Fresh & Chilled Food,Ruby,Ruby Plain Madras Poppadums,90,200g,NA,LIFE 1m+,India,4.6,139,92,"Urad Flour, Rice Flour, Salt, Vegetable Oil, Sodium Bicarbonate",,,https://www.ocado.com/productImages/431/43116011_0_150x150.jpg?identifier=bff8ac0cc29485358850dd893acf7bbb,https://www.ocado.com/products/ruby-plain-madras-poppadums-43116011,https://www.ocado.com/browse/fresh-chilled-food-20002?hideOOS=true
Fresh & Chilled Food,DAYLESFORD ORGANIC,"Chateau Leoube, Sparkling de Leoube, Rose Brut Nature, Daylesford Organic",30,75cl,Organic,NA,NA,5.0,1,100,NA,,,https://www.ocado.com/productImages/359/359155011_0_150x150.jpg?identifier=18d54fe39f04096b5ddc78e03acf3bd8,https://www.ocado.com/products/chateau-leoube-sparkling-de-leoube-rose-brut-nature-daylesford-organic-359155011,https://www.ocado.com/browse/fresh-chilled-food-20002?hideOOS=true
Fresh & Chilled Food,Valsoia,Valsoia Sweetened Soya Milk Light,1.75,1L,Suitable for vegetarians,NA,NA,3.7,30,67,"Water, Soya Beans (4.7%), Cane Sugar, Vegetable Fibre (Inulin) (0.55%), Calcium Phosphate, Sea Salt, Stabiliser: Gellan Gum, Flavourings, Vitamins: Riboflavin (B2)-B12-D2Allergen Information",,,https://www.ocado.com/productImages/309/309819011_0_150x150.jpg?identifier=700d8eca4e54cbbadbfe6cc05fb2656f,https://www.ocado.com/products/valsoia-sweetened-soya-milk-light-309819011,https://www.ocado.com/browse/fresh-chilled-food-20002?hideOOS=true
"Soft Drinks, Tea & Coffee",Twinings,Twinings Inner Clarity Lemon Balm and Camomile Tea with Tulsi,4,18 per pack,Suitable for vegetarians,NA,NA,4.5,24,92,"Camomile* (55%), Lemon Balm* (15%), Tulsi* (8%), Natural Lemon Flavouring with other Natural Flavourings (7%), Lemon Peel* (5%), Elderflower*, Natural Lemongrass Flavouring, Natural Flavouring, *All our herbs are gently steamed, the process is gentle to protect their delicate taste",,,https://www.ocado.com/productImages/557/557740011_0_150x150.jpg?identifier=2a88a0e1acc4109ad93e269c3be476e6,https://www.ocado.com/products/twinings-inner-clarity-lemon-balm-and-camomile-tea-with-tulsi-557740011,https://www.ocado.com/browse/soft-drinks-tea-coffee-20977?hideOOS=true
Fresh & Chilled Food,The Cultured Collective,The Cultured Collective Turmeric & Ginger Kimchi,5.45,250g,Suitable for vegetarians,NA,Switzerland,4.2,83,80,"Chinese Leaf Cabbage, Water, Mooli, Spring Onion, Onion, Carrot, Garlic, Ginger (2.6%), Chilli Flakes, Sea Salt, Sugar, Glutinous Rice Flour, Turmeric (0.3%), Cayenne Pepper, Black Pepper",,,https://www.ocado.com/productImages/411/411273011_0_150x150.jpg?identifier=14d6a2c49f49f27b919bf0e9bf3f730d,https://www.ocado.com/products/the-cultured-collective-turmeric-ginger-kimchi-411273011,https://www.ocado.com/browse/fresh-chilled-food-20002?hideOOS=true
Fresh & Chilled Food,Itsu,itsu Chicken Gyoza with Dipping Pot,3.5,133g,Suitable for the microwave,LIFE 3d+,NA,4.5,58,85,"Gyoza: Gyoza Filling: Chicken (Thigh & Skin) (37%), Cabbage, White Onion, Spring Onion (5%), Soy Sauce (Water, Soya Beans, Wheat, Salt), Ginger, Yeast Extract, Garlic, Chicken Stock (Water, Chicken, Salt), Sesame Oil, Textured Soya Protein, Sugar, Salt, Water, Black Pepper, Turmeric, Gyoza Skin: Wheat Flour, Water, Tapioca Starch, Wheat Gluten, Rapeseed Oil, Salt, Turmeric, Ponzu Sauce (14%): Soy Sauce (Water, Soya Beans, Wheat, Salt, Alcohol), Rice Vinegar, Sugar, Water, Glucose Syrup, Mirin (Fermented Rice, Water, Maltose, Alcohol), Alcohol, Apple Puree, Salt, Ginger Puree, Garlic Puree, Konbu Extract (Water, Seaweed, Salt), White Pepper",,,https://www.ocado.com/productImages/562/562418011_0_150x150.jpg?identifier=63e9f06e283f9fee31aa81d05b1a0d9c,https://www.ocado.com/products/itsu-chicken-gyoza-with-dipping-pot-562418011,https://www.ocado.com/browse/fresh-chilled-food-20002?hideOOS=true
Fresh & Chilled Food,Jack Link,Jack Links Original Beef Jerky,1.5,25g,NA,NA,Brazil,3.5,64,57,"Beef, Sugar, Sea Salt, Dried Soy Sauce [(Wheat, Soybeans, Salt), Maltodextrin], Hydrolysed Corn Protein, Yeast Extract, Curing Salt (Salt, Preservative (Sodium Nitrite)), Garlic Powder, Onion Powder, Antioxidant (Extract of Rosemary), Acidity Regulator (Citric Acid), Flavourings, Pineapple Powder, It takes 186 g of Beef for 100 g of Beef Jerky",,,https://www.ocado.com/productImages/549/549025011_0_150x150.jpg?identifier=33ba76adf609274363b41834f877dfb9,https://www.ocado.com/products/jack-links-original-beef-jerky-549025011,https://www.ocado.com/browse/fresh-chilled-food-20002?hideOOS=true
"Soft Drinks, Tea & Coffee",Roastworks,Roastworks Kenya Ground Coffee,4.5,200g,Suitable for vegetarians,NA,"Kenya, United Kingdom",4.0,39,77,100% Arabica Coffee,,,https://www.ocado.com/productImages/466/466929011_0_150x150.jpg?identifier=2904da582c144d1948c172ef98f7343e,https://www.ocado.com/products/roastworks-kenya-ground-coffee-466929011,https://www.ocado.com/browse/soft-drinks-tea-coffee-20977?hideOOS=true
Fresh & Chilled Food,Leerdammer,Leerdammer Light Dutch Cheese Slices,2,160g,Suitable for vegetarians,LIFE 1m+,Netherlands,4.2,46,79,"Milk, Salt, Lactic Fragments, Vegetarian Rennet",,,https://www.ocado.com/productImages/277/27771011_0_150x150.jpg?identifier=1e9801260309aa5a8b83c72f03d8cdb0,https://www.ocado.com/products/leerdammer-light-dutch-cheese-slices-27771011,https://www.ocado.com/browse/fresh-chilled-food-20002?hideOOS=true
Fresh & Chilled Food,M&S,M&S Four Cheese Sauce,2.9,350g,"Suitable for freezing, Suitable for the microwave",LIFE 7d+,"Italy, UK",3.5,2,50,"Whole Milk, Water, Single Cream (Milk) (10%), Grana Padano Cheese (9%) (Grana Padano Cheese (Milk), Preservative: Lysozyme (Egg)), Provolone Cheese (Milk) (6%), Pecorino Cheese (Milk) (2%), Cornflour, Mascarpone Cheese (Milk) (1%), Salt, Dried Mustard, Potato Starch, Ground White Pepper, Turmeric, Ground Pimentoes",,,https://www.ocado.com/productImages/527/527973011_0_150x150.jpg?identifier=c9281e1fad608cbc8bd7443aba7dcdc2,https://www.ocado.com/products/m-s-four-cheese-sauce-527973011,https://www.ocado.com/browse/fresh-chilled-food-20002?hideOOS=true
Fresh & Chilled Food,M&S,M&S 4 Scottish Salmon Fillets Skin On,9.2,480g,Suitable for freezing,LIFE 2d+,NA,4.0,36,78,NA,,,https://www.ocado.com/productImages/505/505278011_0_150x150.jpg?identifier=9964e284c30b3ef5ea63a8161dd4f0b4,https://www.ocado.com/products/m-s-4-scottish-salmon-fillets-skin-on-505278011,https://www.ocado.com/browse/fresh-chilled-food-20002?hideOOS=true
Bakery,Fitzgeralds,Fitzgeralds Round Multiseed & Cereal Pitta,1.4,6 per pack,"Suitable for freezing, Suitable for the microwave, Suitable for vegetarians",LIFE 2w+,NA,5.0,4,100,"Wholemeal Wheat Flour, Water, Multigrain Mix (14%) [Whole Grain Rye Flour, Spelt Flakes, Oat Flakes, Millet, Sunflower Seed, Flax Seed, Quinoa, Chia, Rye Flour], Yeast, Salt",,,https://www.ocado.com/productImages/561/561700011_0_150x150.jpg?identifier=af2263142bff297dbdec1c1e650745cc,https://www.ocado.com/products/fitzgeralds-round-multiseed-cereal-pitta-561700011,https://www.ocado.com/browse/bakery-25189?hideOOS=true
"Soft Drinks, Tea & Coffee",Kenco,Kenco Duo Cappuccino Instant Coffee,3.7,6 per pack,Suitable for vegetarians,NA,NA,4.0,20,80,"Skimmed Milk Powder (37%), Sugar, Maltodextrin, Fully Hydrogenated Coconut Oil, Instant Coffee (11.8%), Modified Starch, Anti-Caking Agent (E551), Roast and Ground Coffee (0.6%), Stabiliser (E339), Flavourings",,,https://www.ocado.com/productImages/487/487229011_0_150x150.jpg?identifier=43ddfe988064a4c3518c05c594ed8ded,https://www.ocado.com/products/kenco-duo-cappuccino-instant-coffee-487229011,https://www.ocado.com/browse/soft-drinks-tea-coffee-20977?hideOOS=true
"Soft Drinks, Tea & Coffee",Schweppes,Schweppes Elderflower Tonic,1.6,1L,Suitable for vegetarians,NA,NA,3.9,23,74,"Carbonated Water, Citric Acid, Acidity Regulator (Sodium Citrate), Natural Flavourings including Quinine, Sweeteners (Aspartame, Acesulfame K), Preservative (Potassium Sorbate)",,,https://www.ocado.com/productImages/552/552943011_0_150x150.jpg?identifier=b3b64e5bf897a3f2fa8aaba7d6525717,https://www.ocado.com/products/schweppes-elderflower-tonic-552943011,https://www.ocado.com/browse/soft-drinks-tea-coffee-20977?hideOOS=true
Fresh & Chilled Food,Slim-Fast,Slimfast Cafe Latte Milkshake,2.1,325ml,Suitable for vegetarians,NA,NA,3.5,6,67,"Skimmed Milk (78%), Coffee (14%), Maltodextrin, Milk Proteins, Corn Oil, Flavourings, Thickener (Acacia Gum), Stabilisers (Cellulose Gel, Cellulose Gum, Carrageenan), Vitamins and Minerals (Magnesium Citrate, Potassium Phosphate, Ferric Pyrophosphate, Vitamin E, Niacin, Vitamin A, Sodium Selenite, Zinc Oxide, Copper Gluconate, Manganese Sulphate, Pantothenic Acid, Biotin, Vitamin D, Folic Acid, Vitamin K, Vitamin B6, Vitamin B1), Emulsifier (Mono and Diglycerides of Fatty Acids), Antioxidant (Sodium Ascorbate), Cocoa Powder, Sweetener (Sucralose)Allergen Information",,,https://www.ocado.com/productImages/297/297695011_0_150x150.jpg?identifier=2f629852cf1af99f9f6304285f01a21b,https://www.ocado.com/products/slimfast-cafe-latte-milkshake-297695011,https://www.ocado.com/browse/fresh-chilled-food-20002?hideOOS=true
"Soft Drinks, Tea & Coffee",Monin,Monin Sugar Free Caramel Syrup,3,250ml,Suitable for vegetarians,NA,France,4.7,3,100,"Water, bulking agent: polydextrose, natural flavouring, thickener: cellulose gum, sweeteners: sucralose, acesulfame K, acid: tartaric acid (L(+)-), colour: E150a, preservatives: potassium sorbate, sodium benzoate.",,,https://www.ocado.com/productImages/563/563810011_0_150x150.jpg?identifier=607bcd11c163bde4e3b948dfd0aaf658,https://www.ocado.com/products/monin-sugar-free-caramel-syrup-563810011,https://www.ocado.com/browse/soft-drinks-tea-coffee-20977?hideOOS=true
Fresh & Chilled Food,M&S,M&S British Crispy Breaded Chicken Breast Fillets,8.4,750g,Suitable for freezing,LIFE 4d+,UK,3.9,10,70,"Chicken Breast (71%), Wheatflour contains Gluten (with Wheatflour, Calcium Carbonate, Iron, Niacin, Thiamin), Rapeseed Oil, Water, Durum Wheat Semolina (contains Gluten), Rice Flour, Wheat Gluten, Salt, Wheat Starch (contains Gluten), Wheat Protein (contains Gluten), Chicken Stock (Water, Chicken Bones, Salt, Chicken Fat), Yeast, Vinegar, Concentrated Lemon Juice, Yeast Extract Sugar, Dried Onions, Dried Garlic, Ground White Pepper, Dried Sage",,,https://www.ocado.com/productImages/519/519801011_0_150x150.jpg?identifier=1a113eecc4069c50b20b478c8e9f3d19,https://www.ocado.com/products/m-s-british-crispy-breaded-chicken-breast-fillets-519801011,https://www.ocado.com/browse/fresh-chilled-food-20002?hideOOS=true
