category,brand,product,price,weight,badge,shelf_life,country,rating,num_of_reviews,recommend,ingredient,reviews,nutrition,image_link,product_link,category_link
"Soft Drinks, Tea & Coffee",Trucillo,Trucillo Intenso Nespresso Compatible Capsules,3.5,10 per pack,Suitable for vegetarians,NA,NA,3.4,37,55,NA,,,https://www.ocado.com/productImages/503/503303011_0_150x150.jpg?identifier=57df446c953424fcbb260249904b32f7,https://www.ocado.com/products/trucillo-intenso-nespresso-compatible-capsules-503303011,https://www.ocado.com/browse/soft-drinks-tea-coffee-20977?hideOOS=true
Fresh & Chilled Food,M&S,M&S Cherries,2.6,200g,Suitable for vegetarians,LIFE 2d+,NA,3.4,36,56,NA,,,https://www.ocado.com/productImages/517/517872011_0_150x150.jpg?identifier=ad3905ff6b64dd8cd626b79b66097b0d,https://www.ocado.com/products/m-s-cherries-517872011,https://www.ocado.com/browse/fresh-chilled-food-20002?hideOOS=true
"Soft Drinks, Tea & Coffee",Roastworks,Roastworks Ethiopia Natural Whole Bean Coffee,4.5,200g,Suitable for vegetarians,NA,United Kingdom,3.0,5,20,100% Arabica Coffee,,,https://www.ocado.com/productImages/466/466921011_0_150x150.jpg?identifier=463689e5e89a9c3eb725e705a57bbf1f,https://www.ocado.com/products/roastworks-ethiopia-natural-whole-bean-coffee-466921011,https://www.ocado.com/browse/soft-drinks-tea-coffee-20977?hideOOS=true
Fresh & Chilled Food,DAYLESFORD ORGANIC,Daylesford Organic Seaweed Wheat Biscuits,3,120g,Organic,NA,UK,4.0,6,100,"Fortified Wheatflour (Calcium Carbonate*, Iron*, Niacin*, Thiamin*), Water*, Salted Butter (Cream (Milk) Salt*), Sugar, Seaweed (2%), Salt*, Raising Agents (Cream of Tartar*, Bicarbonate of Soda*). *Non-Organic",,,https://www.ocado.com/productImages/315/315683011_0_150x150.jpg?identifier=8eec160cadb97e0e9904fee780b898e3,https://www.ocado.com/products/daylesford-organic-seaweed-wheat-biscuits-315683011,https://www.ocado.com/browse/fresh-chilled-food-20002?hideOOS=true
Fresh & Chilled Food,Curious,Wonderfully Curious Peeled Garlic,1.5,100g,Suitable for vegetarians,LIFE 7d+,Spain,4.3,21,81,NA,,,https://www.ocado.com/productImages/559/559681011_0_150x150.jpg?identifier=cdc4fb9448a6425a78b2201c757c2fc9,https://www.ocado.com/products/wonderfully-curious-peeled-garlic-559681011,https://www.ocado.com/browse/fresh-chilled-food-20002?hideOOS=true
Fresh & Chilled Food,Unearthed,Unearthed Diced Smoked Pancetta,3.25,2 x 77g,NA,LIFE 1w+,Italy,3.2,10,50,"Pork, Salt, Corn Dextrose, White Pepper, Black Peppercorns, Antioxidant: Sodium Ascorbate, Black Pepper, Mace, Coriander, Cinnamon, Juniper, Preservatives: Potassium Nitrate and Sodium Nitrite, Garlic, Prepared with 110g of Pork per 100g of finished product, Moisture is lost during curing and maturation",,,https://www.ocado.com/productImages/520/520441011_0_150x150.jpg?identifier=9551f21f1676577e35574138212e534a,https://www.ocado.com/products/unearthed-diced-smoked-pancetta-520441011,https://www.ocado.com/browse/fresh-chilled-food-20002?hideOOS=true
Fresh & Chilled Food,Yeo Valley,"Yeo Valley Little Yeos Organic Strawberry, Vanilla & Mango Fromage Frais",1.6500000000000001,6 x 45g,"Organic, Suitable for vegetarians",LIFE 1w+,NA,4.0,40,75,"Mango & Vanilla::Organic Fromage Frais (Milk), Organic Concentrated Grape Juice, Organic Mango Purée (5%), Milk Protein, Organic Maize Starch, Organic Vanilla Extract, Natural Flavourings, Organic Concentrated Lemon Juice, Contains the following live cultures: Bifidobacterium, Streptococcus Thermophilus, Lactobacilus Bulgaricus, Lactobacillus Acidophilus.Strawberry & Vanilla::Organic Fromage Frais (Milk), Organic Concentrated Grape Juice, Organic Strawberry Purée (5%), Milk Protein, Organic Maize Starch, Natural Flavourings, Organic Vanilla Extract, Organic Concentrated Lemon Juice, Contains the following live cultures: Bifidobacterium, Streptococcus Thermophilus, Lactobacilus Bulgaricus, Lactobacillus Acidophilus.Allergen Information",,,https://www.ocado.com/productImages/489/48951011_0_150x150.jpg?identifier=cde358e8560ff87a83a281636831a6b1,https://www.ocado.com/products/yeo-valley-little-yeos-organic-strawberry-vanilla-mango-fromage-frais-48951011,https://www.ocado.com/browse/fresh-chilled-food-20002?hideOOS=true
Fresh & Chilled Food,Tropicana,Tropicana Tropical Fruit Juice,4.4,1.7L,Suitable for vegetarians,LIFE 1w+,NA,4.5,11,100,"Apple Juice, Mandarin Juice, Pineapple Juice (9%), Passionfruit Juice (4%), Mango Puree (2%)",,,https://www.ocado.com/productImages/542/54215011_0_150x150.jpg?identifier=6cb9f86d446c68110c3ae6a3a5e89ec3,https://www.ocado.com/products/tropicana-tropical-fruit-juice-54215011,https://www.ocado.com/browse/fresh-chilled-food-20002?hideOOS=true
Fresh & Chilled Food,Dragonfly,Dragonfly Gluten Free Organic Super Firm Fresh Tofu,2.3,300g,"Organic, Suitable for vegetarians",LIFE 2w+,NA,3.9,75,71,"*Water, Soya Beans, Firming Agent, *Nigari (Magnesium Chloride), *Approved Non-Organic ingredient",,,https://www.ocado.com/productImages/247/247337011_0_150x150.jpg?identifier=3d6636c446d4b7eb515af58bb718e6e6,https://www.ocado.com/products/dragonfly-gluten-free-organic-super-firm-fresh-tofu-247337011,https://www.ocado.com/browse/fresh-chilled-food-20002?hideOOS=true
Fresh & Chilled Food,M&S,M&S Savannah Extra Fine Beans,2.3499999999999996,180g,Suitable for vegetarians,LIFE 3d+,NA,4.0,60,75,NA,,,https://www.ocado.com/productImages/517/517986011_0_150x150.jpg?identifier=45d3de6037cae86a9c31b8a9c44176b7,https://www.ocado.com/products/m-s-savannah-extra-fine-beans-517986011,https://www.ocado.com/browse/fresh-chilled-food-20002?hideOOS=true
Fresh & Chilled Food,Natoora,Natoora French Leeks,3.2,700g,Suitable for vegetarians,LIFE 3d+,"France, UK",4.2,21,86,NA,,,https://www.ocado.com/productImages/369/369461011_0_150x150.jpg?identifier=0a083b314eac568d31858816f2e66b5e,https://www.ocado.com/products/natoora-french-leeks-369461011,https://www.ocado.com/browse/fresh-chilled-food-20002?hideOOS=true
"Soft Drinks, Tea & Coffee",Twinings,Twinings Cold In'fuse Watermelon Strawberry & Lemon 12 Infusers,2,12 per pack,Suitable for vegetarians,NA,EU,3.4,28,72,"Hibiscus*, Natural Strawberry Flavouring with other Natural Flavourings (17%), Beetroot*, Rosehips*, Natural Watermelon Flavouring with other Natural Flavourings (7%), Natural Lemon Flavouring (4%), Natural Flavouring, Acid: Citric Acid, Sweetener: Steviol Glycosides, Orange Peel*, *These herbal ingredients are specially heat treated to make them our first ever infuser safe to drop into cold water",,,https://www.ocado.com/productImages/413/413244011_0_150x150.jpg?identifier=4e7e30b994996b71ab4f72790d978e6b,https://www.ocado.com/products/twinings-cold-in-fuse-watermelon-strawberry-lemon-12-infusers-413244011,https://www.ocado.com/browse/soft-drinks-tea-coffee-20977?hideOOS=true
"Soft Drinks, Tea & Coffee",FRUIT SHOOT,Robinsons Fruit Shoot Blackcurrant & Apple No Added Sugar,3,8 x 200ml,Suitable for vegetarians,NA,UK,2.4,9,34,"Water, Fruit Juices from Concentrate (Apple 6%, Blackcurrant 2%, Plum), Acid (Citric Acid), Natural Flavourings, Acidity Regulator (Sodium Citrate), Carrot and Blueberry Concentrate, Antioxidant (Ascorbic Acid), Sweeteners (Acesulfame K, Sucralose)Allergen Information",,,https://www.ocado.com/productImages/226/22651011_0_150x150.jpg?identifier=7fc16624ee12c756c85d68f05b9ae9fc,https://www.ocado.com/products/robinsons-fruit-shoot-blackcurrant-apple-no-added-sugar-22651011,https://www.ocado.com/browse/soft-drinks-tea-coffee-20977?hideOOS=true
Fresh & Chilled Food,DAYLESFORD ORGANIC,Daylesford Hand Wash Rosemary & Lavender Natural,14,250ml,NA,NA,UK,4.5,2,50,NA,,,https://www.ocado.com/productImages/683/68319011_0_150x150.jpg?identifier=6bbd8fa83d41ada7a909beda21fadb2a,https://www.ocado.com/products/daylesford-hand-wash-rosemary-lavender-natural-68319011,https://www.ocado.com/browse/fresh-chilled-food-20002?hideOOS=true
Bakery,Lovemore,Lovemore 2 Chocolate Muffins,2.2,160g,Suitable for vegetarians,LIFE 3w+,United Kingdom,3.3,12,42,"Sugar, Dark Chocolate Chips (17%) (Sugar, Cocoa Mass, Cocoa Butter, Emulsifier (Soya Lecithin), Natural Vanilla Flavouring), Rice Flour, Rapeseed Oil, Water, Pasteurised Egg, Humectant (Glycerol), Cocoa Powder, Modified Maize Starch, Rice Starch, Potato Starch, Raising Agents (Disodium Diphosphate, Sodium Carbonates), Stabiliser (Sodium Stearoyl-2-Lactylate), Preservative (Potassium Sorbate), Salt, Stabiliser (Xanthan Gum), Natural Vanilla Flavouring",,,https://www.ocado.com/productImages/421/421516011_0_150x150.jpg?identifier=2b0831911ca47aad909a1b7178a9544f,https://www.ocado.com/products/lovemore-2-chocolate-muffins-421516011,https://www.ocado.com/browse/bakery-25189?hideOOS=true
Bakery,Genius,Genius Gluten Free Pitta,2.1,3 per pack,"Suitable for freezing, Suitable for the microwave",NA,United Kingdom,3.5,33,64,"Water, Rice Flour, Tapioca Starch, Potato Starch, Rapeseed Oil, Bamboo Fibre, Psyllium Husk Powder, Humectant (Vegetable Glycerol), Haricot Bean Flour, Sugar, Yeast, Stabilisers (Hydroxypropyl Methyl Cellulose, Xanthan Gum), Iodised Salt (Salt, Potassium Iodate), Fermented Maize Starch, Preservative (Potassium Sorbate), Natural Flavouring",,,https://www.ocado.com/productImages/300/300886011_0_150x150.jpg?identifier=42d91bdc82e8087c2cc5fbd27b56f8d4,https://www.ocado.com/products/genius-gluten-free-pitta-300886011,https://www.ocado.com/browse/bakery-25189?hideOOS=true
Fresh & Chilled Food,Ocado,Ocado Mixed Weight Free Range Eggs,2.1,15 per pack,"Suitable for the microwave, Suitable for vegetarians",LIFE 1w+,UK,3.5,279,59,NA,,,https://www.ocado.com/productImages/794/79466011_0_150x150.jpg?identifier=1a27ae59495cbd3a7ba84960111f07cc,https://www.ocado.com/products/ocado-mixed-weight-free-range-eggs-79466011,https://www.ocado.com/browse/fresh-chilled-food-20002?hideOOS=true
"Soft Drinks, Tea & Coffee",M&S,M&S Scottish Still Mountain Water 12x 500ml,2,12 x 500ml,NA,NA,NA,3.9,26,70,NA,,,https://www.ocado.com/productImages/520/520222011_0_150x150.jpg?identifier=cdc26967d82bb65c35689fcbf2e1cd18,https://www.ocado.com/products/m-s-scottish-still-mountain-water-12x-500ml-520222011,https://www.ocado.com/browse/soft-drinks-tea-coffee-20977?hideOOS=true
Fresh & Chilled Food,Abba Seafood,Kalles Kaviar Creamed Smoked Fish Roe Spread,3.5,190g,NA,LIFE 1m+,NA,4.2,69,76,NA,,,https://www.ocado.com/productImages/783/78303011_0_150x150.jpg?identifier=9dd36651ad011e986094a993bf4ae069,https://www.ocado.com/products/kalles-kaviar-creamed-smoked-fish-roe-spread-78303011,https://www.ocado.com/browse/fresh-chilled-food-20002?hideOOS=true
Fresh & Chilled Food,M&S,M&S British Lighter Mature Cheddar,2,350g,Suitable for vegetarians,LIFE 2w+,UK,3.8,20,65,NA,,,https://www.ocado.com/productImages/528/528015011_0_150x150.jpg?identifier=e660623728815464d3c2c46ae60ae9c4,https://www.ocado.com/products/m-s-british-lighter-mature-cheddar-528015011,https://www.ocado.com/browse/fresh-chilled-food-20002?hideOOS=true
Fresh & Chilled Food,President,President French Unsalted Butter,2.1,250g,NA,LIFE 1m+,France,4.5,81,86,"Butter (Milk), Typical Fat content 82%",,,https://www.ocado.com/productImages/148/14862011_0_150x150.jpg?identifier=1465f0e265ada42b9683ad993c4ac797,https://www.ocado.com/products/president-french-unsalted-butter-14862011,https://www.ocado.com/browse/fresh-chilled-food-20002?hideOOS=true
Fresh & Chilled Food,M&S,M&S British Slow Cooked Beef & Ale Casserole,7.85,462g,Suitable for freezing,LIFE 1w+,UK,3.3,29,49,"Beef (64%), Water, Silverskin Onions (6%), Onions, Brown Ale (contains Barley, Wheat, Gluten) (5%), Roast Beef Stock (Water, Beef Bones, Tomato Purée, Onions, Carrots, Shiitake Mushrooms, Seaweed, White Wine Vinegar), Rapeseed Oil, Cornflour, Salt, Sugar, Tomato Purée, Cracked Black Pepper, Roasted Garlic Purée, Concentrated Redcurrant Juice, Thyme, Ground Black Pepper",,,https://www.ocado.com/productImages/519/519769011_0_150x150.jpg?identifier=f8b02d74bdf9d5e4cdcfd7417befecaa,https://www.ocado.com/products/m-s-british-slow-cooked-beef-ale-casserole-519769011,https://www.ocado.com/browse/fresh-chilled-food-20002?hideOOS=true
"Soft Drinks, Tea & Coffee",Ocado,Ocado Italian Blend Roast & Ground Coffee,4.3,454g,Suitable for freezing,LIFE 1m+,NA,3.7,7,72,Coffee (100%).,,,https://www.ocado.com/productImages/313/313340011_0_150x150.jpg?identifier=279a6da4419c94b8309c6e625105d6e3,https://www.ocado.com/products/ocado-italian-blend-roast-ground-coffee-313340011,https://www.ocado.com/browse/soft-drinks-tea-coffee-20977?hideOOS=true
Fresh & Chilled Food,Boursin,Boursin Garlic & Herbs Soft French Cheese,2.1,150g,Suitable for vegetarians,LIFE 1w+,France,5.0,80,97,"Pasteurised Milk and Cream, Lactic Ferments, Garlic and Herbs 1.9%, Salt, Pepper",,,https://www.ocado.com/productImages/372/37297011_0_150x150.jpg?identifier=86ddb02081bd4ef23fa402fa00c9076c,https://www.ocado.com/products/boursin-garlic-herbs-soft-french-cheese-37297011,https://www.ocado.com/browse/fresh-chilled-food-20002?hideOOS=true
"Soft Drinks, Tea & Coffee",Newby Teas,Newby Teas Rooibos Orange Silken Pyramids,6,15 per pack,Suitable for vegetarians,NA,NA,4.6,46,94,"Rooibos, Orange Peel, Orange Flavour, Liquorice",,,https://www.ocado.com/productImages/410/410315011_0_150x150.jpg?identifier=7ee7100c11ecf80818701957db455947,https://www.ocado.com/products/newby-teas-rooibos-orange-silken-pyramids-410315011,https://www.ocado.com/browse/soft-drinks-tea-coffee-20977?hideOOS=true
Bakery,Cadbury,Cadbury Easter Creme Egg Nest Cakes,2.5,4 per pack,Suitable for freezing,LIFE 2w+,NA,1.5,2,0,"Milk Chocolate (26%) [Sugar, Cocoa Mass, Cocoa Butter, Dried Skimmed Milk, Milk Fat, Vegetable Fat (Palm), Dried Whey (from Milk), Emulsifier (Soya Lecithin)], White Fondant (23%) [Sugar, Vegetable Oils (Palm, Rapeseed), Glucose Syrup, Water, Humectant (Glycerol), Flavouring, Emulsifier (E471), Preservative (Potassium Sorbate), Stabiliser (E415)], Yellow Fondant (20%) [Maltodextrin, Sugar, Dextrose, Water, Fructose, Palm Oil, Gelling Agent (Pectin), Flavourings, Emulsifier (E471), Colours (E171, Carotenes, Paprika Extract), Firming Agent (E327), Preservative (Potassium Sorbate), Stabiliser (E415)], Wheat Flour (with added Calcium, Iron, Niacin, Thiamin), Glucose Syrup, Sugar, Humectant (Glycerol), Fat Reduced Cocoa, Soya Flour, Dried Whole Egg, Vegetable Oils (Palm, Rapeseed), Dried Whey (from Milk), Raising Agents (E450, Sodium Bicarbonate), Dried Egg White, Water, Emulsifier (E471), Milk Proteins",,,https://www.ocado.com/productImages/542/542657011_0_150x150.jpg?identifier=bed40da38195cf607557aa33b1715fe1,https://www.ocado.com/products/cadbury-easter-creme-egg-nest-cakes-542657011,https://www.ocado.com/browse/bakery-25189?hideOOS=true
Fresh & Chilled Food,Jude's,Jude's Salted Caramel Milkshake Can,1.7,250ml,Suitable for vegetarians,LIFE 3w+,NA,3.7,22,64,"Semi Skimmed Milk (89%), Water, Sugar, Caramel Sugar Syrup (0.23%), Natural Flavouring, Salt (0.12%), Stabiliser: Carrageenan",,,https://www.ocado.com/productImages/471/471123011_0_150x150.jpg?identifier=7b10056c544ea4827a354c57e4f2fe77,https://www.ocado.com/products/jude-s-salted-caramel-milkshake-can-471123011,https://www.ocado.com/browse/fresh-chilled-food-20002?hideOOS=true
Fresh & Chilled Food,DAYLESFORD ORGANIC,Daylesford Honeycomb Collection,20,NA,Suitable for vegetarians,NA,NA,4.0,5,80,NA,,,https://www.ocado.com/productImages/502/502047011_0_150x150.jpg?identifier=fd90934bf28e0ba41e46392b43c2c856,https://www.ocado.com/products/daylesford-honeycomb-collection-502047011,https://www.ocado.com/browse/fresh-chilled-food-20002?hideOOS=true
Fresh & Chilled Food,The Fresh Pasta Co.,Mattarello Tomato & Mascarpone Sauce,3,230g,"Suitable for freezing, Suitable for the microwave",LIFE 7d+,Italy,3.4,45,65,"Water, Tomato Concentrate, Tomato Pulp (15%) (Tomatoes, Tomato Juice), Mascarpone Cheese (12%) (Milk), Cream (Milk), Sunflower Oil, Onions, Salt, Cornflour, Basil, Fructose, Pecorino Romano PDO Cheese (Milk), Garlic, Black Pepper",,,https://www.ocado.com/productImages/320/320447011_0_150x150.jpg?identifier=35d0fa9c785ccd6528e8c21bbc0623fe,https://www.ocado.com/products/mattarello-tomato-mascarpone-sauce-320447011,https://www.ocado.com/browse/fresh-chilled-food-20002?hideOOS=true
Bakery,Carbzone,Carbzone LowCarb Protein Rich Bread,2.8,250g,Suitable for vegetarians,NA,Germany,4.1,63,80,"Water, Protein Mix (12%) (Wheat Protein, Pea Protein), Brown Linseed, Whole Rye Flour, Soy Meal (6%), Soy Flour (3%), Wheat Bran, Golden Linseed, Sunflower Seeds, Sesame, Yeast, Oat Fibre, Salt, Acidity Regulator (Sodium Diacetate), Enriched Protein Whey Powder (Milk)Dietary Information",,,https://www.ocado.com/productImages/304/304465011_0_150x150.jpg?identifier=8a996e9934e9e9fbdf9a2b0fda0f11e4,https://www.ocado.com/products/carbzone-lowcarb-protein-rich-bread-304465011,https://www.ocado.com/browse/bakery-25189?hideOOS=true
"Soft Drinks, Tea & Coffee",Volcano Coffee Works,Volcano Coffee Works Balanced All Day Ground Coffee,27,1kg,Suitable for vegetarians,NA,Brazil,5.0,1,100,NA,,,https://www.ocado.com/productImages/549/549577011_0_150x150.jpg?identifier=9e4393b0f3572a388b3b2466ed1bc1d4,https://www.ocado.com/products/volcano-coffee-works-balanced-all-day-ground-coffee-549577011,https://www.ocado.com/browse/soft-drinks-tea-coffee-20977?hideOOS=true
Fresh & Chilled Food,Pukka Pies,Pukka Pies Minced Beef & Onion,1.8,215g,Suitable for freezing,LIFE 4d+,United Kingdom,2.9,34,56,NA,,,https://www.ocado.com/productImages/653/65324011_0_150x150.jpg?identifier=4330062bbc9c511273eb56dcd42d3d6f,https://www.ocado.com/products/pukka-pies-minced-beef-onion-65324011,https://www.ocado.com/browse/fresh-chilled-food-20002?hideOOS=true
"Soft Drinks, Tea & Coffee",Nix & Kix,Nix & Kix Raspberry Rhubarb,2.8499999999999996,750ml,"Organic, Suitable for vegetarians",NA,NA,4.4,33,94,"Carbonated Water, Fruit Juices from Concentrate 45% (Apple, Rhubarb 2%, Raspberry 2%,) Natural Flavourings, Citric Acid, Purple Carrot Extract, Chilli Extract",,,https://www.ocado.com/productImages/542/542755011_0_150x150.jpg?identifier=9443c9483e9b71866789a1c8834f4c86,https://www.ocado.com/products/nix-kix-raspberry-rhubarb-542755011,https://www.ocado.com/browse/soft-drinks-tea-coffee-20977?hideOOS=true
Fresh & Chilled Food,CPRESS,CPRESS Organic Turmeric Gold Cold Pressed Booster Shot,2,110ml,"Organic, Suitable for vegetarians",LIFE 1w+,NA,3.5,48,61,"Pear Juice (81%), Ginger Juice (10%), Lemon Juice (5%), Turmeric Juice (4%), Black Pepper (<1%)Allergen Information",,,https://www.ocado.com/productImages/521/521643011_0_150x150.jpg?identifier=de90e8fcc7cf706f9f48c91a6be66490,https://www.ocado.com/products/cpress-organic-turmeric-gold-cold-pressed-booster-shot-521643011,https://www.ocado.com/browse/fresh-chilled-food-20002?hideOOS=true
"Soft Drinks, Tea & Coffee",R Whites,R Whites Lemonade,1.35,2L,Suitable for vegetarians,NA,UK,2.3,16,32,"Carbonated Water, Sugar, Lemon Juice from Concentrate (2%), Acid (Citric Acid), Flavouring, Acidity Regulator (Sodium Citrate), Sweeteners (Saccharin, Acesulfame K, Aspartame), Preservative (Sodium Benzoate)",,,https://www.ocado.com/productImages/163/16300011_0_150x150.jpg?identifier=08407761081ead6ea011e2216ae5f774,https://www.ocado.com/products/r-whites-lemonade-16300011,https://www.ocado.com/browse/soft-drinks-tea-coffee-20977?hideOOS=true
Bakery,Hovis,Hovis Medium Sliced Granary Original,1.6500000000000001,800g,"Suitable for freezing, Suitable for vegetarians",LIFE 2d+,NA,3.4,52,60,"Wheat Flour (with added Calcium, Iron, Niacin, Thiamin), Water, Original Granary Blend (Granary Malted Wheat Flakes (11%), Malted Barley Flour, Toasted Wheat, Toasted Rye), Wheat Protein, Yeast, Salt, Vinegar, Soya Flour, Granulated Sugar, Barley Flour, Caramelised Sugar, Emulsifier: E472e, Barley Fibre, Flour Treatment Agent: Ascorbic Acid",,,https://www.ocado.com/productImages/159/15926011_0_150x150.jpg?identifier=a553060283ce0d1b534d596a355e75fe,https://www.ocado.com/products/hovis-medium-sliced-granary-original-15926011,https://www.ocado.com/browse/bakery-25189?hideOOS=true
Fresh & Chilled Food,Lye Cross Farm,Lye Cross Farm Extra Mature Cheddar,5.25,350g,Suitable for vegetarians,LIFE 2w+,United Kingdom,3.6,30,67,"Milk, Salt, Vegetarian Non-GMO Microbial Rennet, Starter Culture",,,https://www.ocado.com/productImages/680/68089011_0_150x150.jpg?identifier=3e8d9cdd9f3fd2d2d673b9b53f46275d,https://www.ocado.com/products/lye-cross-farm-extra-mature-cheddar-68089011,https://www.ocado.com/browse/fresh-chilled-food-20002?hideOOS=true
Fresh & Chilled Food,M&S,M&S Reduced Fat Natural Cottage Cheese,1.45,300g,Suitable for vegetarians,LIFE 7d+,UK,2.7,25,44,"Reduced Fat Cottage Cheese (Milk), Salt",,,https://www.ocado.com/productImages/505/505620011_0_150x150.jpg?identifier=8f7d9d6dceb2360c4054a5a3db5a7c72,https://www.ocado.com/products/m-s-reduced-fat-natural-cottage-cheese-505620011,https://www.ocado.com/browse/fresh-chilled-food-20002?hideOOS=true
Fresh & Chilled Food,Florette,Florette Power of Plants Spinach & Baby Kale Mix,1.75,120g,Suitable for vegetarians,LIFE 3d+,"UK, EU",3.6,72,74,"Mixed Salad Leaves and Vegetables in variable proportions: Baby Chard, Baby Kale (25%), Carrot, Spinach (25%)Dietary Information",,,https://www.ocado.com/productImages/448/448787011_0_150x150.jpg?identifier=a14e47470357d99f7278bfc69705afda,https://www.ocado.com/products/florette-power-of-plants-spinach-baby-kale-mix-448787011,https://www.ocado.com/browse/fresh-chilled-food-20002?hideOOS=true
Fresh & Chilled Food,M&S,M&S 6 Dinky Cornish Pasties,2.9,240g,Suitable for freezing,LIFE 4d+,UK,3.1,66,49,"Wheatflour contains Gluten (with Wheatflour, Calcium Carbonate, Iron, Niacin, Thiamin), British Minced Beef (18%), Palm Oil, Potato (12%), Onion (8%), Swede (6%), Water, Cornflour, Rapeseed Oil, Pasteurised Egg, Salt, Roast Beef Stock (Water, Beef Bones, Beef), Garlic Purée, Thyme, Ground Black Pepper, Barley Malt Extract (contains Gluten), Mustard Flour, Yeast Extract, Ground Nutmeg, Ground Sage",,,https://www.ocado.com/productImages/515/515420011_0_150x150.jpg?identifier=a6505d78634c659b125fa374d58a4209,https://www.ocado.com/products/m-s-6-dinky-cornish-pasties-515420011,https://www.ocado.com/browse/fresh-chilled-food-20002?hideOOS=true
Fresh & Chilled Food,M&S,M&S Southern Style Chicken Breast Tenders,4.2,300g,Suitable for freezing,LIFE 4d+,UK,3.1,47,52,"Chicken Breast (68%), Wheatflour contains Gluten (with Wheatflour, Calcium Carbonate, Iron, Niacin, Thiamin), Rapeseed Oil, Water, Wheat Starch (contains Gluten), Rice Flour, Broad Bean Flour, Maize Flour, Salt, Wheat Gluten, Ground Spices (Fennel, Black Pepper, White Pepper, Paprika), Raising Agent: E450, Sodium Bicarbonate, Cracked Black Pepper, Yeast Extract, Wheat Protein (contains Gluten), Dextrose, Yeast, Dried Thyme, Sunflower Oil, Spice Extract, Black Pepper Extract, Thyme Extract",,,https://www.ocado.com/productImages/505/505242011_0_150x150.jpg?identifier=def3c893554eb4aff1ffe6121a3522cf,https://www.ocado.com/products/m-s-southern-style-chicken-breast-tenders-505242011,https://www.ocado.com/browse/fresh-chilled-food-20002?hideOOS=true
Fresh & Chilled Food,M&S,M&S Beef Bolognese Pasta Bake Meal to Share,4.75,800g,Suitable for freezing,LIFE 3d+,UK,4.4,17,83,"Cooked Pasta (39%) (Durum Wheat Semolina (contains Gluten), Water), Beef (21%), Tomatoes (14%), Whole Milk, Cheddar Cheese (Milk) (3%), Red Leicester Cheese (3%) (Red Leicester Cheese (Milk), Colour: Carotenes), Onions, Carrots, Celery, Tomato Paste, Rapeseed Oil, Red Wine Vinegar, Broad Bean Flour, Cornflour, Salt, Garlic Purée, Mature Cheddar Cheese (Milk), Oregano, Coarse Ground Black Pepper, Rosemary, Ground White Pepper, Ground Bay Leaves, Ground Nutmeg",,,https://www.ocado.com/productImages/514/514772011_0_150x150.jpg?identifier=415d9527164a2210de1c5d92e3d874d8,https://www.ocado.com/products/m-s-beef-bolognese-pasta-bake-meal-to-share-514772011,https://www.ocado.com/browse/fresh-chilled-food-20002?hideOOS=true
Fresh & Chilled Food,Samosa Co,SamosaCo Keralan Aubergine Curry,3,350g,"Suitable for freezing, Suitable for the microwave, Suitable for vegetarians",LIFE 1w+,United Kingdom,3.8,82,71,"Aubergine(65%), Onion, Carrot(8%), Tomato Puree, Rapeseed Oil, Garlic, Ginger, Ground Coriander, Salt, Cumin Seed, Ground Chilli, Turmeric, Asafoetida, Lemon Juice, Crushed Chilli",,,https://www.ocado.com/productImages/565/565103011_0_150x150.jpg?identifier=6df0482b270726676d403012bb061d8b,https://www.ocado.com/products/samosaco-keralan-aubergine-curry-565103011,https://www.ocado.com/browse/fresh-chilled-food-20002?hideOOS=true
Fresh & Chilled Food,M&S,M&S Perfectly Ripe White Nectarines,3.15,4 per pack,Suitable for vegetarians,LIFE 3d+,NA,2.9,54,50,NA,,,https://www.ocado.com/productImages/518/518228011_0_150x150.jpg?identifier=cfb22cb90c911b7288a33712e7aaabce,https://www.ocado.com/products/m-s-perfectly-ripe-white-nectarines-518228011,https://www.ocado.com/browse/fresh-chilled-food-20002?hideOOS=true
Fresh & Chilled Food,M&S,M&S Beef Hotpot Mini Meal,2.3499999999999996,200g,"Suitable for freezing, Suitable for the microwave",LIFE 2d+,UK,2.3,11,28,"Cooked British Beef (24%), Water, Potatoes (21%), Onions, Carrots (3.5%), Swede (3.5%), Cornflour, Roast Beef Stock (Water,  Beef Bones, Tomato Purée, Onions, Carrots), Tomato Purée, Balsamic Vinegar, Salt, Rapeseed Oil, Colour: Plain Caramel, Garlic Purée, Vinegar, Sugar Syrup, Cracked Black Pepper, Dried Onions, Tamarind Extract, Ground Black Pepper, Ground Cloves, Lemon Oil",,,https://www.ocado.com/productImages/516/516668011_0_150x150.jpg?identifier=27b709a3b7746c517fb2fd2099f861e2,https://www.ocado.com/products/m-s-beef-hotpot-mini-meal-516668011,https://www.ocado.com/browse/fresh-chilled-food-20002?hideOOS=true
Fresh & Chilled Food,M&S,M&S Banzzai Orange,1.5,NA,Suitable for vegetarians,LIFE 3d+,NA,4.3,14,79,NA,,,https://www.ocado.com/productImages/525/525627011_0_150x150.jpg?identifier=4b46c0a4f516a5b11856583999cfade4,https://www.ocado.com/products/m-s-banzzai-orange-525627011,https://www.ocado.com/browse/fresh-chilled-food-20002?hideOOS=true
