product_link,badge,ingredient,brand,country,rating,count,recommend
https://www.ocado.com/products/sukin-natural-hydrating-facial-moisturiser-pump-277240011,Suitable for vegetarians,"Ingredients: Aqua, Aloe Barbadensis Leaf Juice, Sesamum Indicum (Sesame) Seed Oil, Cetearyl Alcohol, Cetyl Alcohol, Glycerin, Ceteareth-20, Rosa Canina Fruit Oil (Rose Hip), Theobroma Cacao (Cocoa) Seed Butter, Butyrospermum Parkii (Shea Butter), Simmondsia Chinensis (Jojoba) Seed Oil, Persea Gratissima (Avocado) Oil, Triticum Vulgare (Wheat) Germ Oil, Tocopherol (Vitamin E), Equisetum Arvense (Horsetail) Extract, Arctium Lappa (Burdock) Extract, Urtica Dioica (Nettle) Extract, Phenoxyethanol, Benzyl Alcohol, Citrus Tangerina (Tangerine) Peel Oil, Citrus Nobilis (Mandarin Orange) Peel Oil, Lavandula Angustifolia (Lavender) Oil, Vanillin,Vanilla Planifolia Extract, Citrus Paradisi (Grapefruit) Seed Extract, Linalool, * Limonene. * * Natural component of essential oils.",Sukin,Australia,4.1,23,70
https://www.ocado.com/products/sure-advanced-72h-protection-women-anti-perspirant-ultimate-fresh-roll-on-456231011,NA,"Aqua, Aluminum Sesquichlorohydrate, PPG-15 Stearyl Ether, Glycerin, Steareth-2, Calcium Chloride, Glycine, Parfum, Steareth-20, Disodium EDTA, Caprylic/Capric Triglyceride, Pentaerythrityl Tetra-di-t-butyl Hydroxyhydrocinnamate, Hydrated Silica, Gelatin Crosspolymer, BHT, Sodium Benzoate, Cellulose Gum, Alpha-Isomethyl Ionone, Benzyl Alcohol, Benzyl Salicylate, Citronellol, Hexyl Cinnamal, Limonene, Linalool",Sure,Italy,3.5,79,74
https://www.ocado.com/products/vitabiotics-ultra-glucosamine-700mg-tablets-236462011,NA,"Glucosamine Sulphate (as Potassium Chloride [from Crustacean], [Carrier: Polyvinylpyrrolidone]), USP††, Microcrystalline Cellulose, Tablet Coating (Hydroxypropylcellulose, Hydroxypropylmethylcellulose, Capric/Caprilic Triglyceride, Natural Source Colours [Titanium Dioxide, Iron Oxides]), Anti-Caking Agents: Silicon Dioxide, Stearic Acid & Magnesium Stearate, ††USP = United States PharmacopeiaAllergen InformationContains Crustaceans, Free From LactoseAllergy InformationMade in a site that may handles NutsDietary InformationNot Tested on Animals",Vitabiotics,NA,4.0,2,50
https://www.ocado.com/products/biore-deep-cleansing-pore-strips-for-blackhead-removal-494414011,NA,"Nose Strips: Polyquaternium-37, Silica, Aqua, Glycerin, Polysilicone-13, PEG-12 Dimethicone, Butylene Glycol, Tocopherol, Stearyl Glycyrrhetinate, Hamamelis Virginiana Leaf Extract, Methylparaben, Aluminum Hydroxide, CI 77891, Face Strips: Polyquaternium-37, Silica, Aqua, Glycerin, Polysilicone-13, PEG-12 Dimethicone, Aluminum Hydroxide, Butylene Glycol, Tocopherol, Stearyl Glycyrrhetinate, Hamamelis Virginiana Leaf Extract, Methylparaben, CI 77891",Biore,Japan,4.2,19,90
https://www.ocado.com/products/centrum-advance-for-men-tablets-236449011,NA,"Calcium salts of orthophosphoric acid (Dicalcium phosphate); Magnesium oxide; Calcium carbonate; Bulking agents: E 460, E 464, E 1200; L-ascorbic acid; DL-alpha tocopheryl acetate; Anticaking agents: E 468, E 551, E 553b; Nicotinamide; Ferrous fumarate; Calcium D-pantothenate; Zinc oxide; Manganese sulphate; Emulsifier: E 470b; Gelatine; Pyridoxine hydrochloride; Thiamin mononitrate; Riboflavin; Beta-carotene; Vegetable oil (Coconut & Palm kernel); Cupric sulphate; Retinyl acetate; Pteroylmonoglutamic acid; Chromium (III) chloride; Sodium molybdate; Potassium iodide; Sodium selenate; D-biotin; Antioxidant: E 321; Phylloquinone; Cholecalciferol; Cyanocobalamin; Colours: E 171, E 132. As we are always looking to improve our products, our formulations change from time to time, so please always check the packaging before use.Allergen InformationFree From Gluten, Free From Lactose, Free From Nuts, Free From Wheat",Centrum,NA,NA,NA,NA
https://www.ocado.com/products/cetaphil-gentle-skin-cleanser-419540011,NA,"Aqua/Water, Cetyl Alcohol, Propylene Glycol, Butylparaben, Methylparaben, Propylparaben, Sodium Lauryl Sulfate, Stearyl Alcohol, FIL 0214.V00",Cetaphil,Canada,4.8,6,100
https://www.ocado.com/products/dove-advanced-care-antiperspirant-deodorant-for-women-clean-touch-aerosol-521855011,NA,"‎Ingredients:Butane, Isobutane, Propane, Cyclopentasiloxane, PPG-14 Butyl Ether, Aluminum Chlorohydrate, Parfum, Helianthus Annuus Seed Oil, Disteardimonium Hectorite, C12-15 Alkyl Benzoate, Octyldodecanol, BHT, Propylene Carbonate, Dimethiconol, Niacinamide",Dove,Italy,4.2,41,83
https://www.ocado.com/products/love-beauty-planet-volume-bounty-conditioner-420864011,Suitable for vegetarians,"Aqua, Cetearyl Alcohol, Behentrimonium Chloride, Cocos Nucifera Oil, Parfum, Dipropylene Glycol, Acrylates/Beheneth-25 Methacrylate Copolymer, Disodium EDTA, Magnesium Nitrate, Glycerin, Sodium Hydroxide, Cocos Nucifera Water, Sodium Lauryl Sulfate, Methylchloroisothiazolinone, Magnesium Chloride, Sodium Benzoate, Methylisothiazolinone, Hexyl Cinnamal, Limonene, LinaloolDietary InformationSuitable for Vegetarians; Suitable for Vegans",Love Beauty & Planet,NA,4.1,28,83
https://www.ocado.com/products/m-s-lifeology-bar-soap-lychee-rose-524850011,NA,"Sucrose, sodium lauryl sulfate, sodium palmate, sorbitol, aqua, propylene glycol, sodium palm kernelate, glycerin, parfum, peg-7 glyceryl cocoate, benzyl salicylate, hexyl cinnamal, linalool, alpha-isomethyl ionone, limonene, ci 77891.",M&S,NA,1.7,3,34
https://www.ocado.com/products/neal-s-yard-mint-bergamot-hand-cream-262292011,NA,"Aqua (Water), Glycerin, Glycine Soja Oil*, Cetearyl Alcohol, Prunus Amydalus Dulcis Oil*, Cera Alba*, Cetearyl Glucoside, Aloe Barbadensis Leaf Juice Powder*, Citrus Limon Peel Oil*, Citrus Bergamia Peel Oil Expressed*, Litsea Cubeba Fruit Oil, Cymbopogon Martini Herb Oil*, Melaleuca Viridifolia Leaf Oil*, Vetiveria Zizanoides Root Oil*, Mentha Spicata Oil*, Levulinic Acid, Sodium Levulinate, Potassium Sorbate, Xanthan Gum, Tocopherol, Helianthus Annuus Seed Oil, Citral, Citronellol, Farnesol, Geraniol, Limonene, Linalool, *Organic ingredient, From essential Oils",Neal's Yard Remedies,England,4.7,6,84
https://www.ocado.com/products/pantene-pro-v-leave-in-hair-thickening-treatment-with-biotin-rose-water-542568011,NA,"Alcohol Denatured, Aqua, Niacinamide, PEG/PPG-20/23 Dimethicone, Caffeine, Acrylates/C10-30 Alkyl Acrylate Crosspolymer, Parfum, Panthenol, Hexyl Cinnamal, Linalool, Hydroxycitronellal, Geraniol, Triethanolamine, Propylene Glycol, Citronellol, Limonene, Rosa Gallica Flower Extract, Biotin, Citric Acid, Potassium Sorbate, Sodium Benzoate",Pantene Pro-V,France,3.2,38,53
https://www.ocado.com/products/schwarzkopf-gliss-total-repair-shampoo-546921011,NA,"Aqua, Sodium Laureth Sulfate, Cocamidopropyl Betaine, PEG-7 Glyceryl Cocoate, Sodium Chloride, Hydrolyzed Keratin, Combretum Farinosum Flower Nectar, Prunus Armeniaca Kernel Oil, Amodimethicone/Morpholinomethyl Silsesquioxane Copolymer, Disodium Cocoamphodiacetate, Parfum, Citric Acid, Sodium Benzoate, Hydrogenated Castor Oil, Glycerin, Guar Hydroxypropyltrimonium Chloride, Sodium Hydroxide, Mica, Dimethicone, Propylene Glycol, Potassium Sorbate, Phenoxyethanol, Cocamide MEA, PEG-40 Hydrogenated Castor Oil, PEG-120 Methyl Glucose Dioleate, Laureth-4, Laureth-23, Linalool, Trideceth-5, Salicylic Acid, Benzyl Alcohol, CI 77891",Schwarzkopf,Germany,5.0,1,100
https://www.ocado.com/products/simple-gentle-care-conditioner-487381011,NA,NA,Simple,Poland,3.9,37,76
https://www.ocado.com/products/tribe-choc-peanut-butter-natural-plant-protein-bars-multipack-539340011,Suitable for vegetarians,"Sunflower Seeds, Almonds (17%), Chicory Root Fibre, Rice Syrup, Coconut Sugar, Pea Protein, Rice Protein, Dairy Free alternative to White Chocolate Chips (6%) [Cocoa Butter, Rice Powder (Rice Syrup, Rice Starch, Rice Flour), Raw Sugar, Natural Flavouring], Sweetened Cranberries (Cranberries, Apple Juice Concentrate, Sunflower Oil), Cocoa Butter, Chia Seeds, Sunflower Oil, Freeze-Dried Raspberries (0.6%), Natural Flavourings.Allergen InformationContains Almonds, Free From Dairy, Free From Gluten.Dietary InformationVegan, Gluten Free, Dairy Free, Source of ProteinProduct detailsSpecificationsVegetarianVeganGluten freeMustard freeCelery freeShellfish freeYeast free",TRIBE,UK,NA,NA,NA
https://www.ocado.com/products/ufit-vegan-chocolate-orange-protein-shake-455112011,Suitable for vegetarians,"Water, Coconut Milk, Pea Protein, Sugar, Chicory Fibre, Fat Reduced Cocoa Powder (1%), Flavourings, Vegetable Oils (Sunflower, Corn), Oat Fibre, Acidity Regulator: Trisodium Citrate, Stabiliser: Carrageenan, Sweetener: Steviol Glycosides, Salt, Vitamin C, Vitamin E, SeleniumAllergen InformationMay Contain Milk, Contains OatsAllergy InformationMade in a factory which also handles Milk products.Dietary InformationSuitable for Vegetarians; Suitable for Vegans",UFit,EU,2.2,6,34
https://www.ocado.com/products/biore-ultra-deep-cleansing-pore-strips-74474011,NA,"Polyquaternium-37, Silica, Aqua, Glycerin, Polysilicone-13, PEG-12 Dimethicone, Parfum, Menthol, Melaleuca Alternifolia Leaf Oil, Aluminum Hydroxide, Butylene Glycol, Tocopherol, Hamamelis Virginiana Leaf Extract, Methylparaben, Limonene, Linalool, CI 77891Dietary InformationSuitable for Vegans",Biore,Japan,3.7,51,69
https://www.ocado.com/products/cura-heat-heat-patch-for-period-pain-544776011,NA,"Iron, Activated Carbon, Water",Cura-Heat,NA,NA,NA,NA
https://www.ocado.com/products/dove-men-care-sport-active-fresh-body-wash-457161011,NA,"Aqua, Sodium Laureth, Sulfate, Petrolatum, Acrylates Copolymer, Parfum, Citric Acid, Cocamide MEA, Glycerin, PPG -12, Sodium Benzoate, Sodium Chloride, Sodium Hydroxide, Tetrasodium EDTA, Tocopherol, Butylphenyl Methylproppional, Citral, Citronellol, Limonenem Linalool, CI 19140",Dove Men Care,Germany,4.4,57,86
https://www.ocado.com/products/durex-extended-pleasure-12-condoms-295941011,NA,NA,Durex,NA,NA,NA,NA
https://www.ocado.com/products/e45-rich-24h-fast-absorbing-moisturiser-hand-cream-for-dry-skin-421466011,NA,"Aqua, Glycerin, Paraffinum Liquidum, Glyceryl Stearate, C12-15 Alkyl Benzoate, Cetyl Alcohol, Dimethicone, Sodium PCA, Phenoxyethanol, Ethylhexylglycerin, Steareth-21, Xanthan Gum, Sodium Cetearyl Sulfate, Hydroxyethyl Urea, Steareth-2, Oenothera Biennis Oil, Disodium EDTA, Citric Acid, Tocopherol, Sodium Hydroxide, Ascorbyl Palmitate",E45,NA,1.7,3,0
https://www.ocado.com/products/earhub-sleepwell-soft-silicone-earplugs-6-pair-531115011,NA,NA,EarHub,China,3.3,4,50
https://www.ocado.com/products/glo-bamboo-incontinence-pads-for-sensitive-bladder-long-502627011,Suitable for vegetarians,NA,Glo,NA,3.4,5,60
https://www.ocado.com/products/jason-sea-fresh-toothpaste-507914011,"Organic, Suitable for vegetarians","Active Ingredients:Sodium Monofluorophosphate 0.76% (Fluoride) - Purpose: AnticavityInactive Ingredients:Glycerin, Aqua (Water), Silica, Sodium Cocoyl Glutamate, Xylitol, Mentha Viridis (Spearmint)Leaf Oil, Aloe Barbadensis Leaf Juice(1), Bambusa Arundinacea Stem Powder, Carum Petroselinum (Parsley) Extract, Citrus Grandis (Grapefruit) Seed Extract, Chlorella Pyrenoidosa Extract, Perilla Ocymoides Seed Extract, Stevia Rebaudiana Leaf/ Stem Extract, Calcium Carbonate, Cellulose Gum, Dimethyl Sulfone, Sea Salt, Tocopheryl Acetate, Sodium Bicarbonate, Sodium Magnesium Silicate, Sodium Sulfate, Ubiquinone(2).(1)Certified Organic Ingredient(2)Coenzyme Q10Product detailsSpecificationsVegan",Jason,NA,3.7,3,67
https://www.ocado.com/products/john-frieda-frizz-ease-3-day-straightening-spray-85934011,NA,"Aqua, Alcohol, Polysilicone-9, Hydrolyzed Keratin, Benzophenone-4, Steartrimonium Chloride, Dipropylene Glycol, Benzyl Alcohol, Malic Acid, Lactic Acid, Sodium Hydroxide, Parfum, Disodium EDTA, Methylparaben, Propylparaben, Linalool, Butylphenyl Methylpropional, Limonene",John Frieda,EU,NA,NA,NA
https://www.ocado.com/products/neal-s-yard-remedies-beauty-sleep-foaming-bath-552244011,"Organic, Suitable for vegetarians","Aqua/Water, Lauryl Glucoside, Cocamidopropyl Betaine, Alcohol Denat.**, Cupressus Sempervirens Leaf/Nut/Stem Oil*, Citrus Sinensis Peel Oil Expressed*, Cananga Odorata Flower Oil*, Levulinic Acid, Styrax Tonkinensis Resin Extract*, Salvia Sclarea (Clary) Oil*, Glycerin, Sodium Levulinate, Aloe Barbadensis Leaf Juice Powder*, Lavandula Angustifolia (Lavender) Flower Extract*, Pogostemon Cablin Leaf Oil*, Narcissus Tazetta Bulb Extract*,Limonene, Linalool, Benzyl Benzoate, Benzyl Salicylate, Farnesol, Geraniol, Eugenol.*Organic. From Essential Oils.Cosmos Organic Of Total 98% Natural Origin, 43% Organic.",Neal's Yard Remedies,NA,NA,NA,NA
https://www.ocado.com/products/neal-s-yard-soothing-bath-oil-43017011,"Organic, Suitable for vegetarians","Glycine Soja (Soybean) Oil*, Helianthus Annuus (Sunflower) Seed Oil, Apricot Kernel Oil Polyglyceryl-10 Esters, Prunus Amygdalus Dulcis (Sweet Almond) Oil*, Lavandula Angustifolia (Lavender) Oil*, Tocopherol, Persea Gratissima (Avocado) Oil*, Pelargonium Graveolens Flower Oil*, Citrus Aurantium Bergamia (Bergamot) Peel Oil*, Cymbopogon Martini Oil*, Cupressus Sempervirens Leaf/Nut/Stem Oil*, Linalool, Geraniol, Limonene, Citronellol, Citral, *Organically produced ingredient, Natural constituent of Essential Oils listed, Made with 84% Organic ingredientsDietary InformationNot Tested on Animals",Neal's Yard Remedies,England,3.0,2,50
https://www.ocado.com/products/nivea-fresh-blends-natural-apricot-mango-rice-milk-shower-body-wash-503738011,NA,"Aqua, Sodium Laureth Sulfate, Cocamidopropyl Betaine, Coco-Glucoside, Sodium Chloride, Prunus Amygdalus Dulcis Oil, Mangifera Indica Juice, Prunus Armeniaca Juice, Oryza Sativa Extract, Glycerin, Bisabolol, Propylene Glycol, Sorbitol, Citric Acid, Glycol Distearate, Laureth-4, Sodium Hydroxide, Xanthan Gum, Cetearyl Glucoside, Glyceryl Stearate SE, Trideceth-9, Sodium Sulfate, Denatonium Benzoate, Sodium Benzoate, Trisodium EDTA, Phenoxyethanol, Potassium Sorbate, Benzoic Acid, Dehydroacetic Acid, Ethylhexylglycerin, Geraniol, Linalool, Parfum, CI 15985, Dehydroacetic Acid, Ethylhexylglycerin, Geraniol, Linalool, Parfum, CI 15985",Nivea,NA,4.0,33,76
https://www.ocado.com/products/olay-total-effects-7in1-light-sun-kissed-glow-moisturiser-37342011,NA,"Aqua, Glycerin, Octocrylene, Ethylhexyl Salicylate, PPG-15 Stearyl Ether, Homosalate, Butyl Methoxydibenzoylmethane, Stearyl Alcohol, Dihydroxyacetone, Dimethicone, Salicylic Acid, Polyethylene, Tocopheryl Acetate, Camellia Sinensis Leaf Extract, BHT, Squalane, Stearyl Dimethicone, Dimethiconol, Sorbitan Stearate, Polysorbate 60, Sorbitan Isostearate, Disodium EDTA, Hydroxyethyl Acrylate/Sodium Acryloyldimethyl Taurate Copolymer, PEG-100 Stearate, Erythrulose, Panthenyl Ethyl Ether, Benzyl Alcohol, Methylparaben, Ethylparaben, Propylparaben, Parfum, Hexyl Cinnamal, Linalool, Limonene, Alpha-Isomethyl Ionone, Caramel",Olay,Poland,4.0,3,67
https://www.ocado.com/products/potters-malt-extract-cod-liver-oil-260378011,NA,"Malt Extract (from Barley), Cod Liver Oil (Fish)Allergen InformationContains Barley, Contains Fish",Potters,UK,3.7,3,67
https://www.ocado.com/products/soft-gentle-orange-white-ginger-antiperspirant-deodorant-spray-512035011,Suitable for vegetarians,"Butane, Isobutane, Propane, Aluminum Chlorohydrate, Isopropyl Palmitate, Isopropyl Myristate, C12-15 Alkyl Benzoate, Parfum, Cocos Nucifera Oil, Disteardimonium Hectorite, Simmondsia Chinensis Seed Oil, Allantoin, Inulin, Propylene Carbonate, Fructose, Limonene, Citral",Soft & Gentle,United Kingdom,4.5,21,86
https://www.ocado.com/products/unbeelievable-health-bee-prepared-max-strength-immune-formula-capsules-376903011,Suitable for vegetarians,"Bee Propolis Extract, Acerola Cherry Extract, Black Elderberry Extract, Olive Leaf Extract, Beta 1,3/1,6 Glucans, Astaxanthin, Reishi Mushrooms, Rice Powder, Vegetarian Capsule Shell.Allergen InformationFree from:GlutenSugarSoyDairyYeast",Unbeelievable,UK,5.0,7,100
https://www.ocado.com/products/vitabiotics-perfectil-plus-skin-hair-nails-tablets-45079011,NA,"Capsule:Omega-3 Fish Oil (from Fish), Capsule Shell (Pharmaceutical Grade Gelatin [Halal Bovine Source], Glycerin, Natural Lemon Flavouring & Colour [Red Iron Oxide]), Starflower Oil, Blackcurrant Seed Oil, Lutein Esters (Lutein, Sunflower Oil, Antioxidant: Natural Tocopherol), Anti-Caking Agent: Silicon Dioxide, Lycopene Extract, Coenzyme Q10, BiotinTablet:Maltodextrin, Bulking Agents: Microcrystalline Cellulose & Dibasic Calcium Phosphate, Magnesium Oxide, Vitamin C (Ascorbic Acid [Carrier: Hydroxypropylmethylcellulose & Tartaric Acid]), Pantothenic Acid (as Calcium Salt), Vitamin E (as D-Alpha Tocopheryl Acid Succinate) (from Soya), Tablet Coating: (Hydroxypropylmethylcellulose, Hydroxypropylcellulose, Capric/Caprilic Triglyceride, Colours [Titanium Dioxide, Iron Oxides], Microcrystalline Cellulose, Stearic Acid), Zinc Sulphate, Ferrous Fumarate, Anti-Caking Agents: Stearic Acid, Silicon Dioxide & Magnesium Stearate, Niacin (as Nicotinamide), L-Cysteine, Grape Seed Extract, Thiamin (Vitamin B1 as Mononitrate), Vitamin B6 (Pyridoxine HCI), Vitamin B12 (Cyanocobalamin [Carriers: Trisodium Citrate, Citric Acid, Maltodextrin]), Betacarotene (Carriers: Starch, Water, Antioxidant: DL-Alpha Tocopherol), Crosslinked Cellulose Gum, Riboflavin (Vitamin B2), Vitamin D3 (Cholecalciferol [Carriers: Acacia, Sucrose, Corn Starch, Medium Chain Triglycerides, Antioxidant: DL-Alpha Tocopherol]), Chromium Trichloride, Copper Sulphate, Manganese Sulphate, Folic Acid (as Pteroylmonoglutamic Acid), Potassium Iodide, Sodium Selenate, BiotinAllergen InformationContains Fish, May Contain Nuts, Contains SoyaAllergy InformationCapsule:Made in a site that may handle Nuts.Tablet:Made in a site that may handle Nuts.Dietary InformationGluten free; Not Tested on Animals",Vitabiotics,NA,4.7,3,100
https://www.ocado.com/products/betteryou-magnesium-body-butter-279187011,Suitable for vegetarians,NA,Better You,UK,4.0,6,67
https://www.ocado.com/products/boostball-keto-chocolate-brownie-shake-562743011,Suitable for vegetarians,"Water, Coconut Water, Coconut Cream, Powdered Coconut MCT, Pea Protein, Fat Reduced Cocoapowder (1%), Chicory Dietary Fibre, Flavourings, Stabiliser: Carrageenan, Acidity Regulator: Trisodium Citrate, Sweetener: Steviol GlycosidesDietary InformationSuitable for VegansProduct detailsSpecifications100% Recyclable CardboardShake well, drink chilled ",Boostball,United Kingdom,3.5,2,50
https://www.ocado.com/products/centrum-fresh-fruit-multivitamin-multimineral-supplement-tablet-486858011,NA,"Sweetener: Xylitol; Magnesium oxide;Calcium salts of orthophosphoric acid (Dicalciumphosphate); L-ascorbic acid; Acidity regulator: E 330;Emulsifiers: E470b, E 570; Anticaking agent: E 551;Ferrous fumarate; Bulking agent: E 460; Palm oil;DL-alpha tocopheryl acetate; Flavouring; Modifiedstarch; Nicotinamide; Zinc oxide; Potassium chloride;Calcium D-pantothenate; Sweetener: E 951; Gelatine;Manganese sulphate; Starch; Thiamine mononitrate;Pyridoxine hydrochloride; Retinyl acetate; Riboflavin;Pteroylmonoglutamic acid; D-biotin; Sodium selenate;Antioxidant: E 321; Phylloquinone; Cholecalciferol;Cyanocobalamin.As we are always looking to improve our products, our formulations change from time to time, so please always check the packaging before use.Allergen InformationFree From Gluten, Free From Lactose, Free From Nuts, Free From Wheat",Centrum,NA,4.0,2,50
https://www.ocado.com/products/centrum-multivitamin-performance-tablets-25482011,NA,NA,Centrum,UK,5.0,1,100
https://www.ocado.com/products/colgate-max-white-complete-toothpaste-500651011,Suitable for vegetarians,"Glycerin, Propylene Glycol, Calcium Pyrophosphate, PEG/PPG-116/66 Copolymer, PVP, PEG-12, Pentasodium Triphosphate, Sodium Lauryl Sulfate, Silica, Aroma, Sodium Monofluorophosphate, Disodium Pyrophosphate, Sodium Saccharin, Hydrogen Peroxide, Benzyl Alcohol, Eugenol, Limonene, CI 74160Contains: Sodium MonofluorophosphateTotal Fluoride content: 1450 ppm",Colgate,Poland,3.0,25,60
https://www.ocado.com/products/old-spice-deodorant-stick-captain-50ml-551369011,NA,"Aqua, Sodium Lauroamphoacetate, Hydrated Silica, Glycerin, Sorbitol, PEG-200 Hydrogenated Glyceryl Palmate, Sodium Myristoyl Sarcosinate, Acrylates Copolymer, Sodium Trideceth Sulfate, Tocopheryl Acetate, Niacinamide, Panthenol, Ascorbic Acid, Salicylic Acid, Rubus Idaeus Fruit Extract, Fragaria Chiloensis Fruit Extract, Serica Extract, Zea Mays Silk Extract, BHT, PEG-100, Butylene Glycol, Propylene Glycol, PEG-7 Glyceryl Cocoate, Glycol Distearate, Laureth-10, Trideceth-3, Cocamide MEA, Magnesium Nitrate, Disodium EDTA, Tetrasodium EDTA, Sodium Sulfate, Sodium Chloride, Magnesium Chloride, Citric Acid, Lactic Acid, Sodium Laureth Sulfate, Lauric Acid, Polyquaternium-10, Methylchloroisothiazolinone, Methylisothiazolinone, Parfum, Hexyl Cinnamal, CI 17200, CI 19140",Old Spice,NA,4.0,31,84
https://www.ocado.com/products/qv-moisturising-cream-500g-518789011,Suitable for vegetarians,"Aqua (Water), Paraffinum Liquidum, Glycerin, Petrolatum, Cetearyl Alcohol, Dimethicone, Squalane, Ceteareth-20, Stearic Acid, Laureth-3, Glyceryl Stearate, Methylparaben (E218), Dichlorobenzyl Alcohol",QV,NA,4.4,27,89
https://www.ocado.com/products/schwarzkopf-styling-keratin-heat-spray-546932011,NA,"Aqua, Alcohol Denat., Propylene Glycol, Polyurethane-48, Hydrolyzed Keratin, Sodium Benzoate, PEG-60, Hydrogenated Castor Oil, Cetyl Ethylhexanoate, Bis-Isobutyl PEG/PPG-20/35/Amodimethicone Copolymer, Parfum, Lactic Acid, Polysorbate 80, Butylene Glycol, Gluconolactone, Methylpropanediol, Linalool, Limonene, Benzyl Alcohol, Citronellol, Geraniol",Schwarzkopf,Hungary,5.0,1,100
https://www.ocado.com/products/schwarzkopf-styling-volume-lift-mousse-546936011,NA,"Aqua, Alcohol Denat., Butane, Propane, VP/VA Copolymer, Polyquaternium-11, Sodium Benzoate, Cetrimonium Chloride, Lactic Acid, Isobutane, Parfum, Hydrolyzed Collagen, Panthenol, Phenoxyethanol, Caprylyl Glycol, Citric Acid, Linalool, Limonene, Benzyl Alcohol, Citronellol, Geraniol, Pantolactone",Schwarzkopf,Germany,4.0,1,100
https://www.ocado.com/products/slimfast-advanced-rich-chocolate-keto-fuel-shake-10-servings-530437011,Suitable for vegetarians,"Coconut Oil Powder (Milk), Calcium Caseinate (Milk), Fat-Reduced Cocoa Powder (19%), Medium Chain Triglyceride Powder (7%) (Milk), Avocado Oil Powder (3%), Flavouring (Milk), Stabilisers (Xanthan Gum, Sodium Carboxy Methyl Cellulose), Salt, Sweeteners (Sucralose, Acesulfame K), Vitamin B6, Zinc Oxide, Vitamin B12Allergen InformationMay Contain Cereals Containing Gluten, May Contain Eggs, Contains Milk, May Contain Nuts, May Contain Peanuts, May Contain SoyaAllergy InformationMay contain Gluten, Egg, Peanuts, Soya, Nuts.Dietary InformationNo Sugar",Slim Fast,NA,3.3,20,50
https://www.ocado.com/products/this-works-deep-sleep-pillow-spray-76553011,NA,"Aqua, Polysorbate 20, Parfum, Lavandula Angustifolia (Lavender) Oil, Pogostemon Cablin (Patchouli) Oil, Cinnamomum Camphora (Ho Wood) Oil, Vetiveria Zizanoides (Vetivert) Oil, Ormenis Multicaulis (Wild Chamomile) Flower, Extract, Linalool, Diazolidinyl Urea, Geraniol ,Limonene, Iodopropynyl ButylcarbamateMade using 100% pure essential oils",This Works,NA,4.5,22,91
https://www.ocado.com/products/tiana-organic-omega-3-coconut-spreadable-butter-261477011,"Organic, Suitable for vegetarians","Organic Extra Virgin Coconut Oil, Organic Coconut Oil, Organic Olive Oil, Organic Cold Pressed Flaxseed OilAllergen InformationFree From Gluten, Free From Wheat, Free From Fish, Free From Lactose, Free From Dairy, Free From Nuts, Free From Soya\SoybeansDietary InformationSuitable for Vegans; Organic; Suitable for Vegetarians; No Added Salt; No Added Sugar",Tiana,United Kingdom,3.7,28,65
https://www.ocado.com/products/vitabiotics-osteocare-liquid-354370011,Suitable for vegetarians,"Purified Water, Raw Cane Sugar, Humectant: Sorbitol, Calcium Carbonate (as Calcium Salt), Magnesium Hydroxide, Thickeners: Veegum & Crosslinked Cellulose Gum, Zinc Gluconate, Natural Flavourings: Mint Oil & Orange Oil, Preservative: Potassium Sorbate, Emulsifier: Polysorbate 80, Stabiliser: Riboflavin Phosphate, Vitamin D (Cholecalciferol)Allergen InformationMay Contain NutsAllergy InformationMade in a site that may handle Nuts.Dietary InformationSuitable for Vegetarians; Not Tested on Animals",Vitabiotics,NA,4.6,5,80
